dms_code,venue_name,venue_address,pincode,region,state,city,status,google_ratings,google_review_count
NR1-UP-3068,KALINDI INFOTECH,"1ST FLOOR KALINDI PLAZA 100 FEET ROAD KALINDI VIHAR NH2, 282006",282006,NORTH ONE,UTTAR PRADESH,AGRA,Inactive,4.1,117
NR1-UP-3069,YASH INFOTECH ONLINE EXAMINATION CENTER,"AGRA, UTTAR PRADESH",Pincode Missing,NORTH ONE,UTTAR PRADESH,AGRA,Inactive,3,108
NR1-UP-3070,RBS INSTITUTE,"AGRA, UTTAR PRADESH",Pincode Missing,NORTH ONE,UTTAR PRADESH,AGRA,Inactive,3.9,145
NR1-UP-3071,RV ONLINE CENTRE,"AGRA, UTTAR PRADESH",Pincode Missing,NORTH ONE,UTTAR PRADESH,AGRA,Inactive,4.2,215
NR1-UP-3072,KRISHNA INFOTECH,"AGRA, UTTAR PRADESH",Pincode Missing,NORTH ONE,UTTAR PRADESH,AGRA,Inactive,3.7,66
NR1-UP-3073,RCS MEMORIAL DEGREE COLLEGE,"NH-11, SAHARA, NEAR MIDAKUR, NANPUR, 283105",283105,NORTH ONE,UTTAR PRADESH,AGRA,Inactive,-,-
NR1-UP-3074,SPS INFOTECH,"SHRI PRATAP SINGH MAHAVIDYALAYA, NEAR BY GANPAT COLD WARE HOUSE ,PILI POKHAR HATHRAS ROAD ,, 283126",283126,NORTH ONE,UTTAR PRADESH,AGRA,Inactive,3.2,64
NR1-UP-3075,SGD INSTITUTE OF EDUCATION CENTRE,"SARASVATI PLACE NAGLA VRANDHAVAN DEVRI ROAD, 282010",282010,NORTH ONE,UTTAR PRADESH,AGRA,Inactive,-,-
NR1-UP-3076,SW INFOTECH,"AGRA, UTTAR PRADESH",Pincode Missing,NORTH ONE,UTTAR PRADESH,AGRA,Inactive,4.8,4
NR1-UP-3077,GB INFOTECH,"146 , RAJRAI OPP. NALANDA TOWN, SHAMSHABAD ROAD ,, 282004",282004,NORTH ONE,UTTAR PRADESH,AGRA,Active,-,-
NR1-UP-3078,GPS INFOTECH,"AGRA, UTTAR PRADESH",Pincode Missing,NORTH ONE,UTTAR PRADESH,AGRA,Inactive,3.5,243
NR1-UP-3462,MINARWA GROUP OF INSTITUION,"Agra, UTTAR PRADESH",Pincode Missing,NORTH ONE,UTTAR PRADESH,Agra,Inactive,3.6,10
NR1-UP-3537,CBS COLLAGE OF ENG & MANAGEMENT,"PELLI POKHAR , POIYA,, 282006",282006,NORTH ONE,UTTAR PRADESH,AGRA,Active,3.3,3
NR1-UP-3601,GOVERNMENT ITI AGRA,"BALKESHWAR ROAD, AGRA, CHAKA UTTAR PRADESH282004",282004,NORTH ONE,UTTAR PRADESH,AGRA,Active,Govt. Venues/IITs/IIMs,Govt. Venues/IITs/IIMs
NR1-UP-3632,RLI INFOTECH,"RLI INFOTECH BODLA BICHPURI ROAD, BEHIND CS AUHJA OVERSEAS PVT LTD., MAGHATAI, AGRA, UTTAR PRADESH - 283105 282007BEHIND CS AUHJA OVERSEAS PVT LTD.",282007,NORTH ONE,UTTAR PRADESH,AGRA,Active,2.6,2
NR1-UP-3650,"GOVERNMENT ITI, FATEHABAD, AGRA [402]","GOVT ITI FATEHABAD, AGRA- UTTAR PRADESH 283111",283111,NORTH ONE,UTTAR PRADESH,AGRA,Venue Removed,Govt. Venues/IITs/IIMs,Govt. Venues/IITs/IIMs
NR1-UP-3732,"GOVERNMENT ITI KHAIRAGARH, AGRA [490]","AGRA JAGNER ROAD, DOODA DHARI KHAIRAGARH, AGRA, 283119",283119,NORTH ONE,UTTAR PRADESH,AGRA,Active,3.8,12
NR1-UP-3379,GOVT ITI ALIGANJ,"CHANDRA LOK, ALIGANJ, UTTAR PRADESH, 226024",226024,NORTH ONE,UTTAR PRADESH,ALIGANJ,Active,Govt. Venues/IITs/IIMs,Govt. Venues/IITs/IIMs
NR1-UP-3079,APS ONLINE ASSESSMENT CENTER,"ALIGARH, UTTAR PRADESH",Pincode Missing,NORTH ONE,UTTAR PRADESH,ALIGARH,Inactive,3.6,51
NR1-UP-3080,DRONA INTERNATIONAL SCHOOL,"ON NEW DELHI BYPASS HIGHWAY OPPOSITE CHIKHAWATI MOD BEHIND NURSING FARM HOUSE, 202002",202002,NORTH ONE,UTTAR PRADESH,ALIGARH,Inactive,-,-
NR1-UP-3252,TRIVEDI COLLEGE OF IT AND MANAGEMENT,"ALIGARH, UTTAR PRADESH",Pincode Missing,NORTH ONE,UTTAR PRADESH,ALIGARH,Inactive,3.8,307
NR1-UP-3253,VIVEKANANDA COLLEGE OF TECHNOLOGY AND MANAGEMENT,"ALIGARH, UTTAR PRADESH",Pincode Missing,NORTH ONE,UTTAR PRADESH,ALIGARH,Inactive,3.8,334
NR1-UP-3318,GOVT ITI ALIGARH,"ITI ROAD, NEAR EXHIBITION GROUND,, 202001",202001,NORTH ONE,UTTAR PRADESH,ALIGARH,Active,Govt. Venues/IITs/IIMs,Govt. Venues/IITs/IIMs
NR1-UP-3484,A FUTURE TECH,"DR SHANNO RANI SARASWATI KANYA MAHAVIDYALAYA , KESHAV SEVA DHAM , SINGHARPUR , MATHURA ROAD ALIGARH,UTTAR PRADESH, 202002",202002,NORTH ONE,UTTAR PRADESH,ALIGARH,Active,5,2
NR1-UP-3523,SANTSAR PUBLIC SCHOOL,"BHANKHRI KHAS G.T. ROAD, 202001",202001,NORTH ONE,UTTAR PRADESH,ALIGARH,Inactive,-,-
NR1-UP-3617,PM COLLEGE OF EDUCATION,PM COLLEGE OF EDUCATION 10TH MILE STONE ALIGARH KHAIR PALWAL ROAD CITY :ALIGARH PIN CODE :202001 DISTRICT:ALIGARH STATE : UTTAR PRADESH,202001,NORTH ONE,UTTAR PRADESH,ALIGARH,Active,4.1,4
NR1-UP-3651,"GOVERNMENT ITI, KOL, ALIGARH [171]","NEAR NAWAB SINGH INTER COLLEGE, KASIMPUR POWER HOUSE, KOIL, ALIGARH UTTAR PRADESH 202127",202127,NORTH ONE,UTTAR PRADESH,ALIGARH,Venue Removed,Govt. Venues/IITs/IIMs,Govt. Venues/IITs/IIMs
NR1-UP-3652,"GOVERNMENT ITI, ATRAULI, ALIGARH [009]","RAM GHAT ROAD, ATRAULI, ALIGARH UTTAR PRADESH 202280",202280,NORTH ONE,UTTAR PRADESH,ALIGARH,Venue Removed,Govt. Venues/IITs/IIMs,Govt. Venues/IITs/IIMs
NR1-UP-3728,VENUE AGREEMENT DEMO,"ALIGARH, UTTAR PRADESH, 202001",202001,NORTH ONE,UTTAR PRADESH,ALIGARH,Inactive,4.9,108
NR1-UP-3335,SP COMPUTER INSTITUTE,"SAHARA PUBLIC GIRLS INTER COLLEGE KARAMAT KI CHOWKI, KARELI, 211016",211016,NORTH ONE,UTTAR PRADESH,ALLAHABAD,Inactive,-,-
NR1-UP-3453,AIIT & MANAGEMENT COLLEGE-2,"NEW TOWN HALL PUBLIC SCHOOL, ANDAWA GT ROAD,, 211019",211019,NORTH ONE,UTTAR PRADESH,Allahabad,Active,3.8,64
NR1-UP-3454,XCELLENCE INFOTECH,"5/12-E CHAKDAUNDI, ARAIL MODH, NAINI, 211008",211008,NORTH ONE,UTTAR PRADESH,Allahabad,Active,3.8,3
NR1-UP-3081,MMM COLLEGE OF IT & MANAGEMENT,"KAJIPUR, NAINI, ALLAHABAD/PRAYAGRAJ, UTTAR PRADESH, 211008",211008,NORTH ONE,UTTAR PRADESH,ALLAHABAD/PRAYAGRAJ,Inactive,3.3,158
NR1-UP-3082,HL SKILL & IT SOLUTION,"CHHATNAG ROAD, JHUNSI,, 211019",211019,NORTH ONE,UTTAR PRADESH,ALLAHABAD/PRAYAGRAJ,Inactive,-,-
NR1-UP-3084,ABHIJEET SKILL CENTRE,"JALALPUR GHOSI, JHALWA,, 211012",211012,NORTH ONE,UTTAR PRADESH,ALLAHABAD/PRAYAGRAJ,Inactive,3.6,256
NR1-UP-3088,AM OXFORD PUBLIC SCHOOL,"ALLAHABAD/PRAYAGRAJ, UTTAR PRADESH",Pincode Missing,NORTH ONE,UTTAR PRADESH,ALLAHABAD/PRAYAGRAJ,Inactive,4.1,112
NR1-UP-3089,SP CONVENT INTER COLLEGE,"SAHAJPURAM, MUNDERA CHUNGI,, 211011",211011,NORTH ONE,UTTAR PRADESH,ALLAHABAD/PRAYAGRAJ,Inactive,3.6,272
NR1-UP-3090,NARAYANA CHARITABLE & EDUCATIONAL SOCIETY,"ALLAHABAD/PRAYAGRAJ, UTTAR PRADESH",Pincode Missing,NORTH ONE,UTTAR PRADESH,ALLAHABAD/PRAYAGRAJ,Inactive,3.5,45
NR1-UP-3091,INDIAN INSTITUTE OF COMPUTER EDUCATION- CENTRE 2,"C P GAUTAM INTER COLLEGE KAUSHAMBI ROAD JHALWA, 211012",211012,NORTH ONE,UTTAR PRADESH,ALLAHABAD/PRAYAGRAJ,Inactive,4.8,4
NR1-UP-3092,KAMTA SINGH GIRLS PG COLLEGE,"PATEL NAGAR, JHUNSI, ALLAHABAD/PRAYAGRAJ, UTTAR PRADESH, 211019",211019,NORTH ONE,UTTAR PRADESH,ALLAHABAD/PRAYAGRAJ,Active,3.8,3
NR1-UP-3093,NAND KISHORE SINGH COMPUTER ACADEMY,"ANDAWA, SARAI INAYAT,, 221505",221505,NORTH ONE,UTTAR PRADESH,ALLAHABAD/PRAYAGRAJ,Inactive,4,4
NR1-UP-3094,RD INSTITUTE FOR COMPUTER EDUCATION,"FCI ROAD, CHAKA, NAINI,, 211008",211008,NORTH ONE,UTTAR PRADESH,ALLAHABAD/PRAYAGRAJ,Inactive,4.2,4
NR1-UP-3095,SP EDUCATION INSTITUTE OF IT & MANAGEMENT,"487 TRANSPORT NAGAR, DHOOMANGANJ, 211011",211011,NORTH ONE,UTTAR PRADESH,ALLAHABAD/PRAYAGRAJ,Inactive,-,-
NR1-UP-3096,VINAYAK IT COLLEGE,"2/4A SABJI MANDI BYPASS, PHAPHAMAU,, 211013",211013,NORTH ONE,UTTAR PRADESH,ALLAHABAD/PRAYAGRAJ,Inactive,3.4,175
NR1-UP-3097,VIVEKANAND PUBLIC INTER COLLEGE,"ALKA VIHAR COLONY,BAMRUTI,, 211012",211012,NORTH ONE,UTTAR PRADESH,ALLAHABAD/PRAYAGRAJ,Inactive,3.6,3
NR1-UP-3535,PRAYAG INFOTECH,"LEELAPUR ROAD, CHAMANGANJ JHUSI,, 211019",211019,NORTH ONE,UTTAR PRADESH,ALLAHABAD/PRAYAGRAJ,Inactive,2.8,23
NR1-UP-3536,UNITED INSTITUTE OF TECHNOLOGY,"D-3, UPSIDC INDUSTRIAL AREA, NAINI, PRAYAGRAJ - 211010 (UP)",211010,NORTH ONE,UTTAR PRADESH,ALLAHABAD/PRAYAGRAJ,Active,4.1,1056
NR1-UP-3380,GOVT ITI AMBEDKAR NAGAR,"GJMG+C87, PAKHANPUR, AMBEDKAR NAGAR, UTTAR PRADESH, 224190",224190,NORTH ONE,UTTAR PRADESH,AMBEDKAR NAGAR,Active,Govt. Venues/IITs/IIMs,Govt. Venues/IITs/IIMs
NR1-UP-3425,WITS COMPUTER INSTITUTE,"PATEL NAGAR (TANDA ROAD) AKBARPUR, 224122",224122,NORTH ONE,UTTAR PRADESH,AMBEDKAR NAGAR,Active,3,3
NR1-UP-3464,TRANS INSTITUTE,"BARABANKI ROAD NEAR BYPASS GURUKUL NAGAR AKBARPUR, 224122",224122,NORTH ONE,UTTAR PRADESH,Ambedkar Nagar,Active,4,291
NR1-UP-3653,GOVERNMENT INDUSTRIAL TRAINING INSTITUTE-AKABARPUR AMBEDKAR NAGAR [224],"GOVT INDUSTRIAL TRAINING INSTITUTE AKBARPUR, AMBEDKAR NAGAR UTTAR PRADESH 224122",224122,NORTH ONE,UTTAR PRADESH,AMBEDKAR NAGAR,Venue Removed,Govt. Venues/IITs/IIMs,Govt. Venues/IITs/IIMs
NR1-UP-3654,GOVERNMENT INDUSTRIAL TRAINING INSTITUTE-JAHANGIRGANJ AMBEDKAR NAGAR [223],"JAHANGIRGANG, AMBEDKAR NAGAR- UTTAR PRADESH 224147",224147,NORTH ONE,UTTAR PRADESH,AMBEDKAR NAGAR,Venue Removed,Govt. Venues/IITs/IIMs,Govt. Venues/IITs/IIMs
NR1-UP-3336,NIRMALA INSTITUTE OF WOMEN EDUCATION AND TECHNOLOGY,"VILLAGE SUBHAWATPUR BISHUNDASPUR, POST GAURIGANJ, 227409",227409,NORTH ONE,UTTAR PRADESH,AMETHI,Active,Govt. Venues/IITs/IIMs,Govt. Venues/IITs/IIMs
NR1-UP-3492,SUDHARMA GROUP OF INSTITUTIONS,"DHAMMAUR SULTANPUR ROAD, 227405",227405,NORTH ONE,UTTAR PRADESH,Amethi,Active,4.1,101
NR1-UP-3655,"GOVERNMENT ITI, GAURIGANJ, AMETHI [109]","GAURIGANJ, SAINTHA ROAD BALIPUR KHURDWA, AMETHI- UTTAR PRADESH 227409",227409,NORTH ONE,UTTAR PRADESH,AMETHI,Venue Removed,Govt. Venues/IITs/IIMs,Govt. Venues/IITs/IIMs
NR1-UP-3402,"GOVERNMENT ITI, AMROHA [043]","VILLAGE KESHOPUR KAILSA ROAD, 244221",244221,NORTH ONE,UTTAR PRADESH,AMROHA,Active,Govt. Venues/IITs/IIMs,Govt. Venues/IITs/IIMs
NR1-UP-3325,"GOVERNMENT ITI, AJITMAL, AURAIYA [213]","GITI AJEETMAL AT ATSU PHAPHUND ROAD, 206121",206121,NORTH ONE,UTTAR PRADESH,AURAIYA,Active,Govt. Venues/IITs/IIMs,Govt. Venues/IITs/IIMs
NR1-UP-3494,S R I T ONLINE EXAM CENTER,"VILL AND POST BAMURIPUR AURAIYA, 206122",206122,NORTH ONE,UTTAR PRADESH,Auraiya,Active,-,-
NR1-UP-3507,RAJESHWARI DEVI SWARNKAR MEMORIAL EDUCATION SOCIETY,"AZAD NAGAR BHAGWATI GANJ STATION ROAD DIBIYAPUR, 206244",206244,NORTH ONE,UTTAR PRADESH,AURAIYA,Active,5,5
NR1-UP-3656,GOVERNMENT ITI-AJITMAL,AT ATSU PHAPHUND ROAD AURAIYA 206121,206121,NORTH ONE,UTTAR PRADESH,AURAIYA,Active,-,-
NR1-UP-3098,INSTITUTE FOR ADVANCED COMPUTER TECHNOLOGY,21/03/44/03 BIHIND CHOTI DEVAKALI MANDIR,224123,NORTH ONE,UTTAR PRADESH,AYODHYA,Active,4.8,77
NR1-UP-3099,WE CARE FOUNDATION,"VAIBHAV PLACE 200 MTR AHEAD, CHANDPUR HARBANS SULTANPUR ROAD, 224001",224001,NORTH ONE,UTTAR PRADESH,AYODHYA,Inactive,3.9,3
NR1-UP-3288,SMB INSTITUTE OF TECHNOLOGY,"TULSINAGAR, AYODHYA, UTTAR PRADESH, 224123",224123,NORTH ONE,UTTAR PRADESH,AYODHYA,Active,3.2,3
NR1-UP-3289,M/S WITS COMPUTER INSTITUTE,"196,DEOKALI ROAD AYODHYA, 224001",224001,NORTH ONE,UTTAR PRADESH,AYODHYA,Inactive,-,-
NR1-UP-3618,BHABHUTI PRASAD SMARAK COLLEGE,"DHARA ROAD, PARIKRAMA MARG, BEHIND AFEEM KOTHI, FAIZABAD, DISTT. AYODHAYA, UTTAR PRADESH-224001",224001,NORTH ONE,UTTAR PRADESH,AYODHYA,Active,-,-
NR1-UP-3643,NARAYAN INSTITUTE OF COMPUTER EDUCATION,"MISTER GUEST HOUSE, PARIKRAMA ROAD, KAUSHALPURI COLONY, PHASE-1, MODHA, FAIZABAD, UTTARPRADESH-224001",224001,NORTH ONE,UTTAR PRADESH,AYODHYA,Active,3.2,3
NR1-UP-3254,RAJ GLOBAL TECHNICAL INSTITUTE,"245, POST - SADAR , AZAMGARH, UTTAR PRADESH, 276001",276001,NORTH ONE,UTTAR PRADESH,AZAMGARH,Active,3.8,3
NR1-UP-3255,MICROKING TRAINING AND RESEARCH ENGINEERING INSTITUTE,"BALRAMPUR, AZAMGARH, UTTAR PRADESH, 276001",276001,NORTH ONE,UTTAR PRADESH,AZAMGARH,Active,4,4
NR1-UP-3313,GOVERMENT ITI AZAMGARH,"RAJKIYE ITI HARRA KI CHUNGI, 276001",276001,NORTH ONE,UTTAR PRADESH,AZAMGARH,Active,Govt. Venues/IITs/IIMs,Govt. Venues/IITs/IIMs
NR1-UP-3403,UMA INSTITUTE OF MANAGEMENT AND TECHNOLOGY,"ARAZIBAG, AZAMGARH, UTTAR PRADESH, 276001",276001,NORTH ONE,UTTAR PRADESH,AZAMGARH,Inactive,3.8,17
NR1-UP-3533,UMA COMPUTER ACADEMY (UMA INSTITUTE OF MANAGEMENT AND TECHNOLOGY),"KENDRIYA VIDYALAY ROAD,HEERAPATTI,, 276001",276001,NORTH ONE,UTTAR PRADESH,AZAMGARH,Active,-,-
NR1-UP-3657,"GOVERNMENT ITI, AZAMGARH [146]","HARRA KI CHUNGI, AZAMGARH UTTAR PRADESH 276001",276001,NORTH ONE,UTTAR PRADESH,AZAMGARH,Venue Removed,Govt. Venues/IITs/IIMs,Govt. Venues/IITs/IIMs
NR1-UP-3658,SHIBLI NATIONAL COLLEGE,"SHIBLI NATIONAL COLLEGE, AZAMGARH U.P. UTTAR PRADESH 276001",276001,NORTH ONE,UTTAR PRADESH,AZAMGARH,Venue Removed,4.3,4
NR1-UP-3659,RAJKIYA ENGINEERING COLLEGE,"VILLAGE AKBALPUR,POST DEVGAON, AZAMGARH, UTTAR PRADESH 276201",276201,NORTH ONE,UTTAR PRADESH,AZAMGARH,Venue Removed,4,4
NR1-UP-3660,GOVERNMENT POLYTECHNIC ATRAULIA AZAMGARH,"VILLAGE- MAKRAHA, KANAILA BAZAR SIKANDARPUR PGI, ATRAULIA, AZAMGARH- UTTAR PRADESH 223223",223223,NORTH ONE,UTTAR PRADESH,AZAMGARH,Venue Removed,Govt. Venues/IITs/IIMs,Govt. Venues/IITs/IIMs
NR1-UP-3758,GOVERNMENT POLYTECHNIC PHOOLPUR AZAMGARH,"VILL-PALIYA MAPHI POST-AMBARI DIST-AZAMGARH, 276304",276304,NORTH ONE,UTTAR PRADESH,AZAMGARH,Active,4.1,60
NR1-UP-3404,"GOVERNMENT ITI, KHEKRA, BAGHPAT","DELHI SAHARANPUR ROAD PATHSALA, 250101",250101,NORTH ONE,UTTAR PRADESH,BAGHPAT,Active,Govt. Venues/IITs/IIMs,Govt. Venues/IITs/IIMs
NR1-UP-3381,GOVERMENT ITI BAHRAICH,"KALEPURWA NEAR CHAUPAL SAGAR NANPARA ROAD BAHRAICH,, 271801",271801,NORTH ONE,UTTAR PRADESH,BAHRAICH,Active,Govt. Venues/IITs/IIMs,Govt. Venues/IITs/IIMs
NR1-UP-3587,VERTEX INSTITUTE OF IT AND MANAGEMENT,"122/110, HUZOORPUR ROAD, BAHRAICH, UTTAR PRADESH-271801",271801,NORTH ONE,UTTAR PRADESH,BAHRAICH,Inactive,4,210
NR1-UP-3100,BRAINWARE COMPUTER,"NCC TIRAHA BALLIA, BALIA, UTTAR PRADESH, 277001",277001,NORTH ONE,UTTAR PRADESH,BALIA,Active,3.4,50
NR1-UP-3101,DR GANESHI PRASAD INSTITUTE OF INFORMATION TECHNOLOGY,"NEAR KUNWAR SINGH CHAURAHA, BALLIA, 277001",277001,NORTH ONE,UTTAR PRADESH,BALIA,Active,3.7,137
NR1-UP-3321,GOVT ITI SIYAR- GR09901073,"GOVT. ITI SIYAR BALLIA NEAR BELTHRA BAZAR HALDIRAM PUR, 221715",221715,NORTH ONE,UTTAR PRADESH,BALIA,Active,Govt. Venues/IITs/IIMs,Govt. Venues/IITs/IIMs
NR1-UP-3661,GOVERNMENT INDUSTRIAL TRAINING INSTITUTE-BALLIA,"GOVT ITI BALLIA , RAMPUR UDAYBHAN BALLIA UTTAR PRADESH 277001",277001,NORTH ONE,UTTAR PRADESH,BALLIA,Venue Removed,Govt. Venues/IITs/IIMs,Govt. Venues/IITs/IIMs
NR1-UP-3368,GOVERNMENT ITI BALRAMPUR,"VISHNUPUR VISHRAM, PACHPERWA, 271206",271206,NORTH ONE,UTTAR PRADESH,BALRAMPUR,Active,Govt. Venues/IITs/IIMs,Govt. Venues/IITs/IIMs
NR1-UP-3256,CICST(CHITRAKOOT INSTITUTE OF COMPUTER SCIENCE & TECHNOLOGY),"NEAR HDFC BANK, MISHRA COMPLEX, ALLAHABAD ROAD, KARWI, 210205",210205,NORTH ONE,UTTAR PRADESH,BANDA,Inactive,-,-
NR1-UP-3432,PUBLIC RELATION ACADEMY,"KATRA BANDA U.P., Banda, UTTAR PRADESH, 210001",210001,NORTH ONE,UTTAR PRADESH,Banda,Active,Govt. Venues/IITs/IIMs,Govt. Venues/IITs/IIMs
NR1-UP-3472,GOVT INDUSTRIAL TRAINING INSTITUTE BANDA,"KANWARA ROAD, NEAR POLICE LINE, 262001",262001,NORTH ONE,UTTAR PRADESH,Banda,Active,Govt. Venues/IITs/IIMs,Govt. Venues/IITs/IIMs
NR1-UP-3382,GOVT ITI BARABANKI,"VILLAGE MAHUAMAU POST DARAHARA, JAHANGIRABAD ROAD,, 225203",225203,NORTH ONE,UTTAR PRADESH,BARABANKI,Active,Govt. Venues/IITs/IIMs,Govt. Venues/IITs/IIMs
NR1-UP-3741,STAR COMPUTER INSTITUTE,"NEAR GGIC, HAIDERGARH, BARABANKI, 225124",225124,NORTH ONE,UTTAR PRADESH,BARABANKI,Active,5,19
NR1-UP-3102,J K INFORMATICS,"J K INFORMATICS (HEAD OFFICE) 4TH FLOOR, R K TOWER, OPP WOODROW SCHOOL, NEAR MEDINOVA HOSPITAL, PASSPORT OFFICE BUILDING, PILIBHIT BYPASS ROAD, BAREILLY, 243005",243006,NORTH ONE,UTTAR PRADESH,BAREILLY,Active,3.6,3
NR1-UP-3103,YATIKAS,"BAREILLY, UTTAR PRADESH, 243001",243001,NORTH ONE,UTTAR PRADESH,BAREILLY,Active,-,-
NR1-UP-3257,YUVA ONLINE TEST CENTER,"16, PILIBHIT BYPASS, BAREILLY, UTTAR PRADESH, 243006",243006,NORTH ONE,UTTAR PRADESH,BAREILLY,Active,3.3,3
NR1-UP-3290,APN INSTITUTE OF EDUCATION,"345, CHUPLA CIVIL LINES, 243001",243001,NORTH ONE,UTTAR PRADESH,BAREILLY,Active,4.2,4
NR1-UP-3291,KEYSKILLS PROFESSIONAL COMPUTERS,"PILIBHIT BYPASS ROAD ,APP MJPPRU, 243005",243005,NORTH ONE,UTTAR PRADESH,BAREILLY,Active,-,-
NR1-UP-3292,SHRI SAI INFO SOLUSTION,"BAREILLY, UTTAR PRADESH",Pincode Missing,NORTH ONE,UTTAR PRADESH,BAREILLY,Inactive,4.3,48
NR1-UP-3294,SHRI SIDDHI VINAYAK TRUST,"SSVGI CAMPUS NANITAL ROAD, 243202",243202,NORTH ONE,UTTAR PRADESH,BAREILLY,Active,4,1283
NR1-UP-3295,SURSUNS INFOTECH PVT LTD,"BAREILLY, UTTAR PRADESH",Pincode Missing,NORTH ONE,UTTAR PRADESH,BAREILLY,Inactive,3.5,112
NR1-UP-3296,UNITY-INTERNATIONAL,"BAREILLY, UTTAR PRADESH",Pincode Missing,NORTH ONE,UTTAR PRADESH,BAREILLY,Inactive,3.3,158
NR1-UP-3493,KPM PUBLIC HIGH SCHOOL ONLINE EXAM CENTER,"BILWA RAILWAY CROSSING VILLAGE BHOORA, 243122",243122,NORTH ONE,UTTAR PRADESH,Bareilly,Inactive,4,80
NR1-UP-3522,ARTECH COMPUTERS,"C. B. GANJ, RAMPUR ROAD,, 243502",243502,NORTH ONE,UTTAR PRADESH,Bareilly,Inactive,4.2,4
NR1-UP-3532,DRISHTI EXAMINATION CENTER,"CC, 146/A, RADHA KRISHNA TOWAR,, 243005",243005,NORTH ONE,UTTAR PRADESH,BAREILLY,Active,3.6,3
NR1-UP-3586,GOVERMENT ITI WORLD BANK MAHILA BAREILLY,"CDPA LAB , GOVERMENT ITI WORLD BANK MAHILA, BAREILLY,UTTAR PRADESH-243001",243001,NORTH ONE,UTTAR PRADESH,BAREILLY,Active,Govt. Venues/IITs/IIMs,Govt. Venues/IITs/IIMs
NR1-UP-3603,GOVERNMENT ITI BAREILLY,"NH-24, RAMPUR ROAD, CB GANJ UTTAR PRADESH BAREILLY, 243502",243502,NORTH ONE,UTTAR PRADESH,BAREILLY,Active,Govt. Venues/IITs/IIMs,Govt. Venues/IITs/IIMs
NR1-UP-3628,SHIV GYAN INTER COLLEGE,"SHIV GYAN INTER COLLEGE,CB GANJ BAREILLY UTTAR PRADESH, 243502",243502,NORTH ONE,UTTAR PRADESH,BAREILLY,Active,-,-
NR1-UP-3104,PARVATI ONLINE CENTER,"BASTI, UTTAR PRADESH",Pincode Missing,NORTH ONE,UTTAR PRADESH,BASTI,Inactive,3.6,273
NR1-UP-3258,COLLEGE OF ENGINEERING & MANAGEMENT TECHNOLOGY,"CANARA BANK, MALVIYA ROAD,, 272001",272001,NORTH ONE,UTTAR PRADESH,BASTI,Inactive,4.1,499
NR1-UP-3451,KARMA DEVI DIGITAL ZONE,"VILLAGE SANSARPUR (PHUTAHIYA), POST GANDHINAGER ,, 272001",272001,NORTH ONE,UTTAR PRADESH,Basti,Inactive,3.9,130
NR1-UP-3465,KPS GROUP OF INSTITUTIONS,"FIRST & IIND FLOOR OF THE GREEN VALLEY ACADEMY APRA CITY PHASE III MISHRAVLIYA STATE MAHVLI MARG, 272130",272130,NORTH ONE,UTTAR PRADESH,Basti,Active,3.7,50
NR1-UP-3473,INSTITUTE OF COMPUTER,"Basti, UTTAR PRADESH",Pincode Missing,NORTH ONE,UTTAR PRADESH,Basti,Inactive,4.5,263
NR1-UP-3566,JAGRITI SEWA SANSTHAN,"INSTITUTE OF TECHNICAL EDUCATION AND SERVICES, POST GANESHPUR,NEAR SUYASH PAPER MILL, DIST- BASTI,UTTAR PRADESH , 272002",272002,NORTH ONE,UTTAR PRADESH,BASTI,Inactive,4.4,61
NR1-UP-3604,"GOVERNMENT ITI, BASTI [150]","KATRA,BASTI SADAR BASTI -UTTAR PRADESH 272001",272001,NORTH ONE,UTTAR PRADESH,BASTI,Active,Govt. Venues/IITs/IIMs,Govt. Venues/IITs/IIMs
NR1-UP-3662,GOVERNMENT ITI-BASTI,"BASTI SADAR, KATRA BASTI 272001",272001,NORTH ONE,UTTAR PRADESH,BASTI,Active,3.3,52
NR1-UP-3469,ADVANCE COMPUTER INSTITUTE,"Bhadohi, UTTAR PRADESH",Pincode Missing,NORTH ONE,UTTAR PRADESH,Bhadohi,Inactive,3.7,430
NR1-UP-3293,ROHILKHAND COMPUTER TRANING INSTITUTE BIJNOR,"R.C.T.I BUKHARA ROAD, BIJNOR, UTTAR PRADESH, 246701",246701,NORTH ONE,UTTAR PRADESH,BIJNOR,Inactive,4.4,36
NR1-UP-3570,"GOVERNMENT ITI, BIJNOR [044]","NAGINA ROAD, OPPOSITE WAVE SUGAR INDUSTRIES, BIJNOR, 246701",246701,NORTH ONE,UTTAR PRADESH,BIJNOR,Active,Govt. Venues/IITs/IIMs,Govt. Venues/IITs/IIMs
NR1-UP-3405,LORD KRISHNA INTERNATIONAL SCHOOL,"BUDAUN, UTTAR PRADESH, 243601",243601,NORTH ONE,UTTAR PRADESH,BUDAUN,Inactive,4,28
NR1-UP-3426,"GOVERNMENT ITI, BADAUN [034]","GOVERNMENT ITI AONLA ROAD, SALARPUR,, 243601",243601,NORTH ONE,UTTAR PRADESH,BUDAUN,Active,Govt. Venues/IITs/IIMs,Govt. Venues/IITs/IIMs
NR1-UP-3447,GAOVERNMENT INDUSTRAIL TRAINING INSTITUTE,"AONLA ROAD, SALARPUR, Budaun, UTTAR PRADESH, 243601",243601,NORTH ONE,UTTAR PRADESH,Budaun,Inactive,-,-
NR1-UP-3547,HORIZON ACADEMY OF COMPUTER SCIENCE,"HOLI CHOWK ,VIJAY NAGAR COLONY, 243601",243601,NORTH ONE,UTTAR PRADESH,Budaun,Inactive,Govt. Venues/IITs/IIMs,Govt. Venues/IITs/IIMs
NR1-UP-3406,MARATHWADA INSTITUTE OF TECHNOLOGY (MIT),"MARATHWADA INSTITUTE OF TECHNOLOGY , DHAMERA CHOLA,, 203131",203131,NORTH ONE,UTTAR PRADESH,BULANDSHAHR,Active,3.5,3
NR1-UP-3538,LEARNERS POINT,"125/13, BULANDSHAHR, UTTAR PRADESH, 203001",203001,NORTH ONE,UTTAR PRADESH,BULANDSHAHR,Active,4,4
NR1-UP-3606,"GOVERNMENT ITI, BULANDSHAHR [013]","GOVT. ITI, SAHKARI NAGAR, ANOOPSHAHR ROAD, BULANDSHAHR UTTAR PRADESH 203150",203150,NORTH ONE,UTTAR PRADESH,BULANDSHAHR,Active,Govt. Venues/IITs/IIMs,Govt. Venues/IITs/IIMs
NR1-UP-3663,GOVERNMENT ITI-BULANDSHAHR,"GOVT. ITI, SAHKARI NAGAR, ANOOPSHAHR ROAD, BULANDSHAHR, 203150",203150,NORTH ONE,UTTAR PRADESH,BULANDSHAHR,Active,-,-
NR1-UP-3664,"GOVERNMENT ITI, KASBA ANUPSHAHR, BULANDSHAHR [179]","ALIGARH ROAD NEAR JP UNIVERSITY, ANOOPSHAHR, BULANDSHAHR - UTTAR PRADESH 203390",203390,NORTH ONE,UTTAR PRADESH,BULANDSHAHR,Venue Removed,Govt. Venues/IITs/IIMs,Govt. Venues/IITs/IIMs
NR1-UP-3576,GOVERNMENT ITI REWASA CHANDAULI,"GOVT. ITI REWASA JANSO KI MANDI CHANDAULI, UTTAR PRADESH 232120",232120,NORTH ONE,UTTAR PRADESH,CHANDAULI,Active,Govt. Venues/IITs/IIMs,Govt. Venues/IITs/IIMs
NR1-UP-3427,CICST(CHITRAKOOT INSTITUTE OF COMPUTER SCIENCE & TECHNOLOGY)-CHITRAKOOT,"INFRONT ON NARAYAN TALKIES, NARAINI ROAD ATARRA ROAD, 210129",210129,NORTH ONE,UTTAR PRADESH,CHITRAKOOT,Inactive,-,-
NR1-UP-3665,"GOVERNMENT ITI, MANIKPUR, CHITRAKOOT [204]","SARHAT, MANIKPUR, CHITRAKOOT UTTAR PRADESH 210208",210208,NORTH ONE,UTTAR PRADESH,CHITRAKOOT - UTTAR PRADESH,Venue Removed,Govt. Venues/IITs/IIMs,Govt. Venues/IITs/IIMs
NR1-UP-3337,ANARI DEVI PVT ITI,"GAYATRI PURAM PIDRA ROAD,, 274001",274001,NORTH ONE,UTTAR PRADESH,DEORIA,Inactive,Govt. Venues/IITs/IIMs,Govt. Venues/IITs/IIMs
NR1-UP-3338,GOVERNMENT ITI LILAPUR BLOCK,"VILLAGE JUNGLE SAHJOULI, P.O. BAITALPUR, 274201",274201,NORTH ONE,UTTAR PRADESH,DEORIA,Active,Govt. Venues/IITs/IIMs,Govt. Venues/IITs/IIMs
NR1-UP-3407,"GOVERNMENT ITI, DEORIA [152]","SALEMPUR ROAD, DEORIA, UTTAR PRADESH, 274001",274001,NORTH ONE,UTTAR PRADESH,DEORIA,Active,Govt. Venues/IITs/IIMs,Govt. Venues/IITs/IIMs
NR1-UP-3508,KRISHNA TECHNICAL INSTITUTE,"DEORIA, UTTAR PRADESH, 274001",274001,NORTH ONE,UTTAR PRADESH,DEORIA,Inactive,3.5,50
NR1-UP-3582,LAKSHYA COMPUTER CLASSES,"SHAKTI COLONY, NEAR PNB BANK,BARHAJ, UTTAR PRADESH 274601",274601,NORTH ONE,UTTAR PRADESH,DEORIA,Inactive,4.2,100
NR1-UP-3666,"GOVERNMENT ITI, SALEMPUR, DEORIA [156]","BARSIPAR PYASI ROAD SALEMPUR, DEORIA UTTAR PRADESH 274509",274509,NORTH ONE,UTTAR PRADESH,DEORIA,Venue Removed,Govt. Venues/IITs/IIMs,Govt. Venues/IITs/IIMs
NR1-UP-3287,INSTITUTE OF COMPUTER SCIENCE & TECHNOLOGY(ICST),"BHARTIO ITI CAMPUS, ETAH, UTTAR PRADESH, 207001",207001,NORTH ONE,UTTAR PRADESH,ETAH,Inactive,4.8,77
NR1-UP-3434,GOVERNMENT ITI ETAH,"KASGANJ ROAD, Etah, UTTAR PRADESH, 207001",207001,NORTH ONE,UTTAR PRADESH,Etah,Active,Govt. Venues/IITs/IIMs,Govt. Venues/IITs/IIMs
NR1-UP-3339,A & A COMPUTRONICS,"BLOCK A IST FLOOR COMMERCIAL COMPLEX, 206001",206001,NORTH ONE,UTTAR PRADESH,ETAWAH,Inactive,3.6,248
NR1-UP-3340,GOVERNMENT ITI ETAWAH,"SAIFAI ROAD, ETAWAH, UTTAR PRADESH, 206001",206001,NORTH ONE,UTTAR PRADESH,ETAWAH,Active,Govt. Venues/IITs/IIMs,Govt. Venues/IITs/IIMs
NR1-UP-3259,INSTITUTE FOR ADVANCED COMPUTER TECHNOLOGY-IFACT,21/3/44/3 B/H - AYODHYA,224123,NORTH ONE,UTTAR PRADESH,FAIZABAD,Active,3.7,430
NR1-UP-3341,GOVERNMENT ITI FAIZABAD,"BENIGANJ, AYODHYA, FAIZABAD, UTTAR PRADESH, 224001",224001,NORTH ONE,UTTAR PRADESH,FAIZABAD,Active,Govt. Venues/IITs/IIMs,Govt. Venues/IITs/IIMs
NR1-UP-3392,SRS DIGITAL INSTITUTE,"MIG-35 KAUSHALPURI COLONY PHASE-2, 224123",224123,NORTH ONE,UTTAR PRADESH,FAIZABAD,Active,3.8,3
NR1-UP-3519,M K GRAMODYOG VIKAS EVAM PRASHIKCHAN SAMITI,"7/2/145A, GAYATRI PURAM, WAZEER GANJ, JAPTI ,CITY FAIZABAD,",224001,NORTH ONE,UTTAR PRADESH,Faizabad,Active,Govt. Venues/IITs/IIMs,Govt. Venues/IITs/IIMs
NR1-UP-3342,GOVERNMENT ITI FARRUKHABAD,"THANDI SADAK, FARRUKHABAD, UTTAR PRADESH, 209625",209625,NORTH ONE,UTTAR PRADESH,FARRUKHABAD,Active,Govt. Venues/IITs/IIMs,Govt. Venues/IITs/IIMs
NR1-UP-3435,NATIONAL INSTITUTE OF SOFTWARE & INFORMATION TECHNOLOGY(NISIT),"LOCO ROAD MASENI, INFRONT OF VIKAS MARRIAGE LAWN, MASENI CHAURAHA,, 209601",209601,NORTH ONE,UTTAR PRADESH,FARRUKHABAD,Inactive,3.7,57
NR1-UP-3667,"GOVERNMENT ITI, FARRUKHABAD [076]",GOVT. ITI THANDI SARAK FARRUKHABAD UTTAR PRADESH 209625,209625,NORTH ONE,UTTAR PRADESH,FARRUKHABAD,Venue Removed,Govt. Venues/IITs/IIMs,Govt. Venues/IITs/IIMs
NR1-UP-3320,GOVT ITI FATEHPUR,"ITI CODE :-GU09001565, GITI ROAD",212601,NORTH ONE,UTTAR PRADESH,FATEHPUR,Active,Govt. Venues/IITs/IIMs,Govt. Venues/IITs/IIMs
NR1-UP-3343,SAGAR ITI,"N.H. - 2, AGRA ROAD, MOHAMMADABAD, TRUNDLA, 283204",283204,NORTH ONE,UTTAR PRADESH,FIROZABAD,Active,Govt. Venues/IITs/IIMs,Govt. Venues/IITs/IIMs
NR1-UP-3408,GOVERNMENT ITI FIROZABAD,"STATION ROAD SWAMINAGAR SHIKOHABAD, 283142",283142,NORTH ONE,UTTAR PRADESH,FIROZABAD,Active,Govt. Venues/IITs/IIMs,Govt. Venues/IITs/IIMs
NR1-UP-3571,RAM SINGH DEGREE COLLAGE,NAGLA SIKANDER TUNDLA ETAH ROAD FIROZABAD UTTAR PRADESH 283204,283204,NORTH ONE,UTTAR PRADESH,FIROZABAD,Active,4.1,177
NR1-UP-3436,SIDDHII INFOTECH,"GAUTAM BUDDHA NAGAR, UTTAR PRADESH",Pincode Missing,NORTH ONE,UTTAR PRADESH,GAUTAM BUDDHA NAGAR,Inactive,3.8,442
NR1-UP-3479,"GOVERNMENT ITI, NOIDA, GAUTAM BUDDH NAGAR","E-01 SECTOR 31 NITHARI NOIDA, 201301",201301,NORTH ONE,UTTAR PRADESH,GAUTAM BUDDHA NAGAR,Inactive,Govt. Venues/IITs/IIMs,Govt. Venues/IITs/IIMs
NR1-UP-3483,"GOVERNMENT ITI, NOIDA, GAUTAM BUDDH NAGAR [025]","E-01 SECTOR 31 NITHARI NOIDA GB NAGAR, 201301",201301,NORTH ONE,UTTAR PRADESH,GAUTAM BUDDHA NAGAR,Inactive,-,-
NR1-UP-3727,BALAJI DIGITAL ZONE,"BALAJI DIGITAL ZONE AT BODHI TARU INTERNATIONAL SCHOOL PLOT NO. 28,GATE NO-3, NEXT TO KAILASH HOSPITAL, KNOWLEDGE PARK-I, PHASE-1, GREATER NOIDA 201308",201309,NORTH ONE,UTTAR PRADESH,GAUTAM BUDDHA NAGAR,Inactive,3.9,3
NR1-UP-3105,ASPIRING WINGS INFOTECH,"A-2, RAMA KRISHNA VIHAR, G.T ROAD SAHIBABAD, IN FRONT OF PILLAR NO. 217,, 201005",201005,NORTH ONE,UTTAR PRADESH,GHAZIABAD,Inactive,3.5,3
NR1-UP-3106,BABU BANARASI DAS INSTITUTE OF TECHNOLOGY,"DELHI- MEERUT ROAD, NEAR DUHAI, ADJACENT TO BRIZZLING LAND, WATER PARK, GHAZIABAD, 201206",201206,NORTH ONE,UTTAR PRADESH,GHAZIABAD,Inactive,3.3,1771
NR1-UP-3107,BHAGWATI INSTITUTE OF TECHNOLOGY AND SCIENCE,"MASURI CANAL, GHAZIABAD, UTTAR PRADESH, 201302",201302,NORTH ONE,UTTAR PRADESH,GHAZIABAD,Inactive,3.7,565
NR1-UP-3442,ADHUNIK ENGINEERING COLLEGE,"Ghaziabad, UTTAR PRADESH",Pincode Missing,NORTH ONE,UTTAR PRADESH,Ghaziabad,Inactive,3.1,142
