dms_code,venue_name,venue_address,pincode,region,state,city,status,google_ratings,google_review_count
NR2-RJ-4530,ARYA COLLEGE OF INDUSTRIAL TRAINING & VOCATIONAL COURSES PVT LTD,"SP-41B,DELHI ROAD, RIICO INDUSTRIAL AREA, KUKAS, 302028",302028,NORTH TWO,RAJASTHAN,JAIPUR,Active,Govt. Venues/IITs/IIMs,Govt. Venues/IITs/IIMs
NR2-RJ-4531,ARYA COLLEGE OF ENGINEERING & I T (IT BLOCK),"SP-42, RIICO INDUSTRIAL AREA, KUKAS,DELHI ROAD, 302028",302028,NORTH TWO,RAJASTHAN,JAIPUR,Active,4.4,5794
NR2-RJ-4532,ARYA COLLEGE OF ENGINEERING & I T (CS BLOCK),"SP-42, RIICO INDUSTRIAL AREA, KUKAS,DELHI ROAD, 302028",302028,NORTH TWO,RAJASTHAN,JAIPUR,Active,4.4,5794
NR2-RJ-4533,RAWAT P G GIRLS COLLEGE,"JAIPUR, RAJASTHAN",Pincode Missing,NORTH TWO,RAJASTHAN,JAIPUR,Inactive,3.8,506
NR2-RJ-4534,BIYANI GIRLS COLLEGE,"JAIPUR, RAJASTHAN",Pincode Missing,NORTH TWO,RAJASTHAN,JAIPUR,Inactive,4,188
NR2-RJ-4535,IT INFRA SERVICES (JAIPUR),"SP 41C RIICO INDUSTRIAL AREA , KUKAS, NATIONAL HIGHWAY 11C, 302028",302028,NORTH TWO,RAJASTHAN,JAIPUR,Inactive,4.2,4
NR2-RJ-4540,ARYA COLLEGE OF ENGINEERING & I T (ACADEMIC BLOCK),"SP-42, RIICO INDUSTRIAL AREA, KUKAS,DELHI ROAD, 302028",302028,NORTH TWO,RAJASTHAN,JAIPUR,Active,4.4,4
NR2-RJ-4552,AGRIMA ONLINE TESTING CENTER,"JAIPUR, RAJASTHAN",Pincode Missing,NORTH TWO,RAJASTHAN,JAIPUR,Inactive,4.2,17
NR2-RJ-4557,GLOBAL SKILL CENTRE C/O GLOBAL INSTITUTE OF TECHNOLOGY SOCIETY,"ITS, 2, IT PARK ROAD, SITAPURA INDUSTRIAL AREA, SITAPURA, 302022",302022,NORTH TWO,RAJASTHAN,JAIPUR,Active,3.7,137
NR2-RJ-4574,MOTHERLAND PROGRESSIVE PUBLIC SCHOOL,"P. NO. 30, VISHVA NATH DHAM, NIWARU ROAD, JHOTWARA, 302012",302012,NORTH TWO,RAJASTHAN,JAIPUR,Active,4.5,4
NR2-RJ-4575,JNM COLLEGE,"JEEWAN SHREE NURSING COLLEGE, JMS NAGAR, NIWARU ROAD, JHOTWARA, 302012",302012,NORTH TWO,RAJASTHAN,JAIPUR,Active,3.6,3
NR2-RJ-4593,IRIS COLLEGE,"27, HARINAGAR EXTENTION, NEW SANGANER ROAD, JAIPUR-302019",302019,NORTH TWO,RAJASTHAN,JAIPUR,Inactive,4.4,4
NR2-RJ-4636,CIPET,"SP - 1298, SITAPURA INDUSTRIAL AREA, PHASE-III, TONK ROAD, JAIPUR - 302022",302022,NORTH TWO,RAJASTHAN,JAIPUR,Inactive,4,4
NR2-RJ-4648,SHRI BHAWANI NIKETAN INSTITUTE OF TECHNOLOGY & MANAGEMENT,"SIKAR ROAD, NEAR MAHARAO SHEKHA CIRCLE (CHOMU PULIA), JAIPUR, RAJASTHAN-302039",302039,NORTH TWO,RAJASTHAN,JAIPUR,Active,4.2,4
NR2-RJ-4667,GANPATI KESHORAI COLLEGE OF NURSING,"40-42, OFFICER'S ENCLAVE, KALYANPURA, MANSAROVAR,JAIPUR, RAJASTHAN-302020",302020,NORTH TWO,RAJASTHAN,JAIPUR,Inactive,4.5,4
NR2-RJ-4694,RAJASTHAN MEMORIAL INSTITUTE OF TECHNOLOGY,"SP 41C, RIICO INDUSTRIAL AREA, KUKAS, JAIPUR, RAJASTHAN-302028",302028,NORTH TWO,RAJASTHAN,JAIPUR,Active,3.9,3
NR2-RJ-4735,KG PUBLIC SENIOR SECONDARY SCHOOL,"MOHALA BUCHAHERA, NAGAJI KI HAR, BAMANWAS ROAD, KOTPUTLI, JAIPUR, RAJASTHAN - 303108",303108,NORTH TWO,RAJASTHAN,JAIPUR,Inactive,5,3
NR2-RJ-4762,ANAND INTERNATIONAL COLLEGE OF ENGINEERING,"NEAR, AGRA RD, KANOTA, JAIPUR, RAJASTHAN 303012, INDIA",303012,NORTH TWO,RAJASTHAN,JAIPUR,Active,4.1,2617
NR2-RJ-4453,JAGTAMBA INFOTECH,"444 MADHAV MARG, NEAR GANDHI BAL PARK, GANDHI COLONY, 345001",345001,NORTH TWO,RAJASTHAN,JAISALMER,Active,4.8,4
NR2-RJ-4496,"GOVT ITI, JAISALMER","JAISALMER, RAJASTHAN",Pincode Missing,NORTH TWO,RAJASTHAN,JAISALMER,Inactive,3.8,9
NR2-RJ-4454,THE JAYHOOO INFOTECH,"NEAR BY 132 KV POWER HOUSE, OPPOSITE GOVERNMENT PG COLLEGE, BHINMAL BY-PASS ROAD, 343001",343001,NORTH TWO,RAJASTHAN,JALORE,Active,4.9,4
NR2-RJ-4741,KRISHNA MAHILA MAHAVIDHYALAYA,"SHIVNATHPURA, SANCHORE, DIST-JALORE, RAJASTHAN-343041",343041,NORTH TWO,RAJASTHAN,JALORE,Inactive,3.8,45
NR2-RJ-4455,SIDDHARTH EDUCATIONAL GROUP,"IN FRONT OF NEW MUNDERI POLICE STATION,KHANPUR ROAD, 326001",326001,NORTH TWO,RAJASTHAN,JHALAWAR,Inactive,Govt. Venues/IITs/IIMs,Govt. Venues/IITs/IIMs
NR2-RJ-4724,BLOSSOM PUBLIC SCHOOL,"OPP. MANDAWAR THANA, MEGA HIGHWAY, KHANPUR ROAD, MUNDERI, JHALAWAR, RAJASTHAN- 326001",326001,NORTH TWO,RAJASTHAN,JHALAWAR,Active,4,2
NR2-RJ-1648,AYAN IT SOLUTION,"B-19, SHIVA TOWER, INDRA NAGAR, JHUNJHUNU, RAJASTHAN-333001",333001,NORTH TWO,RAJASTHAN,JHUNJHUNU,Inactive,5,13
NR2-RJ-4199,BKBIET,"JHUNJHUNU, RAJASTHAN",Pincode Missing,NORTH TWO,RAJASTHAN,JHUNJHUNU,Inactive,4.2,443
NR2-RJ-4200,KEYSTON GROUP OF INSTITUTION,"KEYSTON GROUP OF INSTITUTION, PILOD, SURAJGARH, 333029",333029,NORTH TWO,RAJASTHAN,JHUNJHUNU,Inactive,-,-
NR2-RJ-4550,JAI ONLINE EXAM CENTER,"49 FG VFP , JEET NAGAR BASANT VIHAR, 333001",333001,NORTH TWO,RAJASTHAN,JHUNJHUNU,Inactive,4.6,15
NR2-RJ-4597,RSDC COMPUTER EDUCATION,"1ST FLOOR, TIRUPATI COMPLEX , BEHIND HOTEL SANGAM, JHUNJHUNU, RAJASTHAN- 333001",333001,NORTH TWO,RAJASTHAN,JHUNJHUNU,Inactive,4.8,103
NR2-RJ-4627,RSDC COMPUTER EDUCATION,"1ST FLOOR, TIRUPATI COMPLEX, BEHIND SANGAM HOTEL, JHUNJHUNU, RAJASTHAN, 333001",333001,NORTH TWO,RAJASTHAN,JHUNJHUNU,Active,4.8,103
NR2-RJ-4665,BAGAR INSTITUTE FOR TRAINING OF TRAINERS,"A UNIT OF JYOTI MAHESHWARI FOUNDATION, SMTI CAMPUS, JHUNJHUNU ROAD, BAGAR, JHUNJHUNU, RAJASTHAN - 333023",333023,NORTH TWO,RAJASTHAN,JHUNJHUNU,Active,4.8,4
NR2-RJ-4750,GOVT ITI JHUNJHUNU / ITOT,"VPO- UDAWAS, JHUNJHUNU, RAJASTHAN - 333001",333001,NORTH TWO,RAJASTHAN,JHUNJHUNU,Active,-,-
NR2-RJ-4201,ADHYA INFOTECH,"JODHPUR, RAJASTHAN",Pincode Missing,NORTH TWO,RAJASTHAN,JODHPUR,Inactive,3.8,59
NR2-RJ-4202,DIAMOND ACADEMY SEN SEC SCHOOL,"JODHPUR, RAJASTHAN",Pincode Missing,NORTH TWO,RAJASTHAN,JODHPUR,Inactive,4.9,171
NR2-RJ-4203,DIVYA DIGITAL ZONE,"NEAR ARMY CHILDREN'S ACADEMY SR SEC SCHOOL,ADARSH NAGAR, RAMJAN JI KA HATHA, BANAR ROAD, 342015",342015,NORTH TWO,RAJASTHAN,JODHPUR,Inactive,3.8,89
NR2-RJ-4204,HORIZON TECHNOLOGIES,"PLOT NO. -12, SHANTI NAGAR, OPP. MADHURAM HOTEL, BHADU MARKET, NEAR PAL BALAJI TEMPLE, PAL ROAD, 342008",342008,NORTH TWO,RAJASTHAN,JODHPUR,Active,4.1,745
NR2-RJ-4205,KMMP SCHOOL,"NH-112, DANGIYAWAS BY-PASS, JODHPUR JAIPUR HIGHWAY, 342027",342027,NORTH TWO,RAJASTHAN,JODHPUR,Inactive,4,299
NR2-RJ-4206,MARWAR ITI COLLEGE,"JODHPUR, RAJASTHAN",Pincode Missing,NORTH TWO,RAJASTHAN,JODHPUR,Inactive,4.1,75
NR2-RJ-4207,MARWAR KESERI ONLINE EXAMS CENTRE,"JODHPUR, RAJASTHAN",Pincode Missing,NORTH TWO,RAJASTHAN,JODHPUR,Inactive,3.7,179
NR2-RJ-4208,RC DESIRE POINT,"JODHPUR, RAJASTHAN",Pincode Missing,NORTH TWO,RAJASTHAN,JODHPUR,Inactive,3.7,28
NR2-RJ-4209,SHREE KIRTARAM SHIKSHAN SHANSTHAN,"NEAR THORIYON KI DHANI, GAYATRI NAGAR, PAL ROAD, 342014",342014,NORTH TWO,RAJASTHAN,JODHPUR,Active,-,-
NR2-RJ-4210,SLBS ENGINEERING COLLEGE,"NH-112, JODHPUR - JAIPUR HIGHWAY, NEAR BYPASS DANGIAWAS, 342001",342001,NORTH TWO,RAJASTHAN,JODHPUR,Inactive,3.7,50
NR2-RJ-4211,TELNET TECHNOLOGIES,"PLOT NO.58-59, NEAR BHARAT PETROLEUM, OPP. RAWAT SWEET HOME, INSIDE RAWAT CROSSING, , BANAR ROAD, 342015",342015,NORTH TWO,RAJASTHAN,JODHPUR,Active,3.4,3
NR2-RJ-4212,VIDHYA VALLEY ONLINE EXAMS CENTRE,"JODHPUR, RAJASTHAN",Pincode Missing,NORTH TWO,RAJASTHAN,JODHPUR,Inactive,4.6,42
NR2-RJ-4430,GOVT ITI CENTRAL JAIL JODHPUR,"MOHANPURA, RATANADA, JODHPUR, RAJASTHAN, 342001",342001,NORTH TWO,RAJASTHAN,JODHPUR,Active,Govt. Venues/IITs/IIMs,Govt. Venues/IITs/IIMs
NR2-RJ-4508,SHREE VINAYAK INSTITUTE,"KH NO.- 116, PLOT NO.- 01, DIGARI KALLAN, SHIKARGARH ROAD, 342015",342015,NORTH TWO,RAJASTHAN,JODHPUR,Active,4.3,57
NR2-RJ-4517,G-MAX DIGITAL ZONE,"PLOT NO. 118, PAOTA C ROAD, BJS COLONY, NEAR RTO OFFICE, 342001",342001,NORTH TWO,RAJASTHAN,JODHPUR,Inactive,3.9,86
NR2-RJ-4634,MARWAR INSTITUTE,"7A,7B/203 , NEAR SHIJIT PETROL PUMP, KHOKHARIYA, BANAR ROAD, JODHPUR, RAJASTHAN- 342027",342027,NORTH TWO,RAJASTHAN,JODHPUR,Active,3.8,276
NR2-RJ-4661,PRIME DREAM WEB SOLUTION,"118, ROOP NAGAR, PAOTA C ROAD, NEAR RTO OFFICE, JODHPUR, RAJASTHAN- 342006",342006,NORTH TWO,RAJASTHAN,JODHPUR,Venue Removed,4,4
NR2-RJ-4709,ADHYA INFOTECH,"09, SARVODAYA SCHOOL, SARAN NAGAR, B-ROAD, AJMER ROAD, JODHPUR, RAJASTHAN- 342015",342015,NORTH TWO,RAJASTHAN,JODHPUR,Active,3.8,59
NR2-RJ-1772,LOTUS ONLINE EXAM CENTRE,"NEAR SDJ PG MAHILA MAHAVIDHYALAYA, SHRI MAHAVEERJI, KARAULI, RAJASTHAN- 322220",322220,NORTH TWO,RAJASTHAN,KARAULI,Active,4,41
NR2-RJ-4213,BHARTI EDUCATION CENTER,"KARAULI, RAJASTHAN",Pincode Missing,NORTH TWO,RAJASTHAN,KARAULI,Inactive,3.4,11
NR2-RJ-4456,VIJORIYA FOUNDATION,"KARAULI, RAJASTHAN",Pincode Missing,NORTH TWO,RAJASTHAN,KARAULI,Inactive,4.4,28
NR2-RJ-4542,EKLAVYA COLLEGE,"NEAR GADKARI CHOWK, WAZIPUR ROAD, RIICO AREA, 303108",303108,NORTH TWO,RAJASTHAN,KARAULI,Active,Govt. Venues/IITs/IIMs,Govt. Venues/IITs/IIMs
NR2-RJ-4214,ARYAN POLYTECHNIC COLLEGE,"KOTA, RAJASTHAN",Pincode Missing,NORTH TWO,RAJASTHAN,KOTA,Inactive,3.9,194
NR2-RJ-4215,BITS N BYTES INFOCOM,"27, 1ST AND 2ND FLOOR, NEW STONE MANDI, OPP. JHALAWAR ROAD, 324005",324005,NORTH TWO,RAJASTHAN,KOTA,Inactive,3.8,1100
NR2-RJ-4216,CRYSTAL INFOSOL,"KOTA, RAJASTHAN",Pincode Missing,NORTH TWO,RAJASTHAN,KOTA,Inactive,3.6,146
NR2-RJ-4217,LORD BUDDHA ONLINE EXAMINATION CENTRE,"KOTA, RAJASTHAN",Pincode Missing,NORTH TWO,RAJASTHAN,KOTA,Inactive,3.3,9
NR2-RJ-4218,PARIKSHA DESK,"H-1-10, COMPUTER IT ZONE, ROAD NO.4, 324004",324004,NORTH TWO,RAJASTHAN,KOTA,Inactive,4,568
NR2-RJ-4219,PHOENIX ONLINE EXAMINATION CENTRE,"C/O SARVODYA SR.SEC SCHOOL,RIICO INSTITUTINAL AREA,RANPUR, 325003",325003,NORTH TWO,RAJASTHAN,KOTA,Inactive,3.6,90
NR2-RJ-4220,SHIV JYOTI SR SEC SCHOOL,"KOTA, RAJASTHAN",Pincode Missing,NORTH TWO,RAJASTHAN,KOTA,Inactive,4.1,29
NR2-RJ-4221,SUNRISE DIGITALS,"7-C-31, MAHAVEER NAGAR-3RD, 324005",324005,NORTH TWO,RAJASTHAN,KOTA,Inactive,4.1,40
NR2-RJ-4222,VIABLE SOLUTIONS,"35, SUBHASH NAGAR-1, NEAR GYAN SHANTI HOSPITAL, 324005",324005,NORTH TWO,RAJASTHAN,KOTA,Inactive,3.9,980
NR2-RJ-4431,A4 SOLUTIONS,"KOTA, RAJASTHAN",Pincode Missing,NORTH TWO,RAJASTHAN,KOTA,Inactive,3.8,319
NR2-RJ-4507,INTERSTELLER INFOTECH,"PLOT NO. 2, TRANSPORT NAGAR, NEAR SKYPARK BUILDING, 324005",324005,NORTH TWO,RAJASTHAN,KOTA,Active,3.6,3
NR2-RJ-4513,GURUKUL INSTITUTE OF ENGINEERING AND TECHNOLOGY,"IPB-13,RIICO INSTITUTIONAL AREA, RANPUR, 325003",325003,NORTH TWO,RAJASTHAN,KOTA,Inactive,3.5,3
NR2-RJ-4516,KOTA ONLINE IT EDUCATION,"B- 41, R K PURAM, NEAR BSNL CIRCLE, KOTA, RAJASTHAN-324010",325003,NORTH TWO,RAJASTHAN,KOTA,Inactive,5,5
NR2-RJ-4754,BRIGHTON SCHOOL,"484, CHANDRESAL RD, NEAR SHAGUN VATIKA, PARVATI PURAM, II COLONY, KARI BAWADI, KOTA, RAJASTHAN 324002, INDIA",324002,NORTH TWO,RAJASTHAN,KOTA,Active,4,50
NR2-RJ-4480,SHARDA ITC KOTPUTALI,"BEHIND SHYAM MANDIR, SHARDA PVT ITI, KOTPUTALI, 303108",303108,NORTH TWO,RAJASTHAN,KOTPUTALI,Inactive,Govt. Venues/IITs/IIMs,Govt. Venues/IITs/IIMs
NR2-RJ-4541,SHRI KRISHAN PVT ITI,"BSNL OFFICE EXCHANGE ROAD, NEAR SAINI SABHA, AADARSH NAGAR, KOTPUTALI, JAIPUR-303108",303108,NORTH TWO,RAJASTHAN,KOTPUTALI,Inactive,-,-
NR2-RJ-4553,GROWING MINDS INTERNATIONAL SCHOOL,"AMARPURA NAI KOTHI, WARD NO. 2, 303108",303108,NORTH TWO,RAJASTHAN,KOTPUTALI,Inactive,Govt. Venues/IITs/IIMs,Govt. Venues/IITs/IIMs
NR2-RJ-4544,MARUDHAR COLLEGE,"KARWA KA BASDA, DEEDWANA MEGA HIGHWAY BYPASS, 341508",341508,NORTH TWO,RAJASTHAN,KUCHAMAN CITY,Active,4.5,4
NR2-RJ-4551,TRIMURTI SENIOR SR SCHOOL,"DEEP COLONY, AJMER - NAGAUR ROAD, 341001",341001,NORTH TWO,RAJASTHAN,NAGAUR,Inactive,Govt. Venues/IITs/IIMs,Govt. Venues/IITs/IIMs
NR2-RJ-4663,LBS CONVENT SR SEC SCHOOL,"SECTOR-2, HOUSING BOARD COLONY, LAXMI NAGAR, TAUSAR ROAD, NAGAUR, RAJASTHAN- 341001",341001,NORTH TWO,RAJASTHAN,NAGAUR,Venue Removed,-,-
NR2-RJ-4457,SHREE BANGUR GOVT SR SEC SCHOOL,"NEAR COLLECTORATE , V.D. NAGAR, 306401",306401,NORTH TWO,RAJASTHAN,PALI,Inactive,Govt. Venues/IITs/IIMs,Govt. Venues/IITs/IIMs
NR2-RJ-4490,AISHWARYA COLLEGE,"NAYA GAON ROAD, NEAR B R BIRLA SCHOOL, 306401",306401,NORTH TWO,RAJASTHAN,PALI,Active,Govt. Venues/IITs/IIMs,Govt. Venues/IITs/IIMs
NR2-RJ-4481,CYBERTECH,"BEHIND GOVT SENIOR SECONDARY SCHOOL, PHALODI, 342301",342301,NORTH TWO,RAJASTHAN,PHALODI,Inactive,4.6,77
NR2-RJ-1778,TRIUMPH COLLEGE,"BANSWARA ROAD, BEHIND IOCL PETROL PUMP, PRATAPGARH, RAJASTHAN - 312605",312605,NORTH TWO,RAJASTHAN,PRATAPGARH,Active,5,4
NR2-RJ-4497,"GOVT ITI, PRATAPGARH","PRATAPGARH, RAJASTHAN",Pincode Missing,NORTH TWO,RAJASTHAN,PRATAPGARH,Inactive,-,-
NR2-RJ-4545,MAHI GIRLS COLLEGE,"ROAD, BEHIND IOCL PETROL PUMP, 312605",312605,NORTH TWO,RAJASTHAN,PRATAPGARH,Inactive,4.8,4
NR2-RJ-4770,THE CENTRAL HEIGHTS SCHOOL,"NEEMUCH ROAD, PRATAPGARH, RAJASTHAN",312605,NORTH TWO,RAJASTHAN,PRATAPGARH,Active,-,-
NR2-RJ-4458,NATHDWARA INSTITUTE OF ENGINEERING & TECHNOLOGY,"UPALI ODEN, NATHDAWARA, 313303",313303,NORTH TWO,RAJASTHAN,RAJSAMAND,Active,4.5,4
NR2-RJ-4498,"GOVT ITI, RAJSAMAND","RAJSAMAND, RAJASTHAN",Pincode Missing,NORTH TWO,RAJASTHAN,RAJSAMAND,Inactive,-,-
NR2-RJ-4697,SHRINATHJI INSTITUTE OF TECHNOLOGY & ENGINEERING,"GADWADA ROAD, UPALI ODEN, NATHDWARA, RAJSAMAND, RAJASTHAN-313301",313301,NORTH TWO,RAJASTHAN,RAJSAMAND,Active,4,157
NR2-RJ-1731,DEV IT SKILL,"FIRST FLOOR, GALI NO. 2, BALMANDIR COLONY, SAWAIMADHOPUR 322001",322001,NORTH TWO,RAJASTHAN,SAWAI MADHOPUR,Active,4.3,4
NR2-RJ-4223,GANPATI IT GYAN KENDRA,"C/O ( MAHALAXMI TRADERS ), NEAR ADARSH VIDYA MANDIR SCHOOL, TONK ROAD, BAZARIA, 322001",322001,NORTH TWO,RAJASTHAN,SAWAI MADHOPUR,Inactive,3.7,3
NR2-RJ-4459,SHRI BALAJI ITI,"JAIPUR ROAD BY PASS, GANGAPUR CITY, 322201",322201,NORTH TWO,RAJASTHAN,SAWAI MADHOPUR,Inactive,Govt. Venues/IITs/IIMs,Govt. Venues/IITs/IIMs
NR2-RJ-1635,JAN SHIKSHAN SANSTHAN,"JAN SHIKSHAN SANSTHAN, ROAD NO-3, NEAR GOVT. COMMERCE COLLEGE, SANWALI CIRCLE, TODI NAGAR, SIKAR, RAJASTHAN-332001",332001,NORTH TWO,RAJASTHAN,SIKAR,Active,5,5
NR2-RJ-1652,AN B ED COLLEGE,"RAMU KA BAS, GOKULPURA, PIPRALI SIKAR, RAJASTHAN - 332001",332001,NORTH TWO,RAJASTHAN,SIKAR,Inactive,4.4,55
NR2-RJ-4224,AN SHIKSHA SAMITI,"RAMU KA BAS, GOKULPURA, 332001",332001,NORTH TWO,RAJASTHAN,SIKAR,Active,4,4
NR2-RJ-4225,KHWAJA GHARIB NAWAZ COLLEGE OF NURSING,"SIKAR, RAJASTHAN",Pincode Missing,NORTH TWO,RAJASTHAN,SIKAR,Inactive,4,36
NR2-RJ-4226,NAVJEEVAN COLLEGE OF PHARMACY,"NH-52, KHURI BARI, LAXMANGARH, 332315",332315,NORTH TWO,RAJASTHAN,SIKAR,Inactive,3.8,12
NR2-RJ-4227,NETCOM COMPUTER CENTRE,"INSIDE BHATI MANSION, BAJAJ ROAD, 332001",332001,NORTH TWO,RAJASTHAN,SIKAR,Inactive,5,1
NR2-RJ-4433,MAHATAMA EDUCATION SERVICES,"SIKAR, RAJASTHAN",Pincode Missing,NORTH TWO,RAJASTHAN,SIKAR,Inactive,5,2
NR2-RJ-4460,ARAVALI PG COLLEGE,"SP-1, RIICO INDUSTRIAL AREA, NEEM KA THANA, 332713",332713,NORTH TWO,RAJASTHAN,SIKAR,Active,4.1,4
NR2-RJ-4512,NAVJYOTI CONVENT SCHOOL,"SIKAR, RAJASTHAN",Pincode Missing,NORTH TWO,RAJASTHAN,SIKAR,Inactive,3.5,11
NR2-RJ-4519,BARJI DEVI SHIKSHAN PRASHIKSHAN MAHAVIDYALAYA,"NALA KA BALAJI, KUDLI, PIPRALI ROAD, 332024",332024,NORTH TWO,RAJASTHAN,SIKAR,Inactive,4.3,57
NR2-RJ-4536,SHREE MADAN LAL BIYANI GIRLS ADARSH VIDHYA MANDIR SCHOOL,"OPPOSITE BIOSCOPE MALL, RISHIKUL MARG, RANI SATI ROAD, SIKAR, RAJASTHAN- 332001",332001,NORTH TWO,RAJASTHAN,SIKAR,Active,-,-
NR2-RJ-4537,SOBHASARIA ENGINEERING COLLEGE,"NH 52, GOKULPURA, JAIPUR ROAD, 332001",332001,NORTH TWO,RAJASTHAN,SIKAR,Active,4.3,4
NR2-RJ-4556,SUNRISE INSTITUTE OF TECHNOLOGY AND MANAGEMENT,"SUKH SAMRIDHI RESIDENCY TILAK NAGAR, 332001",332001,NORTH TWO,RAJASTHAN,SIKAR,Inactive,3.6,9
NR2-RJ-4576,VIDYA BHARTI SANSTHAN,"TODI NAGAR, SECTOR-C, NEAR SANWALI CIRCLE, SIKAR, RAJASTHAN-332001, LANDMARK- NEAR SANWALI CIRCLE",332001,NORTH TWO,RAJASTHAN,SIKAR,Inactive,4.1,4
NR2-RJ-4582,SBS SHIKSHAN PRASIKSHAN COLLEGE,"NEAR KV, SCHOOL, NH-52,SABALPURA, SIKAR, RAJASTHAN 332001",332001,NORTH TWO,RAJASTHAN,SIKAR,Inactive,3.9,3
NR2-RJ-4623,AKHIL BHARATI VIDYAPEETH COLLEGE OF NURSING,"GOKULPURA TIRAHA, OPP. MANAV CITY, JAIPUR ROAD, SIKAR, RAJASTHAN-332001",332001,NORTH TWO,RAJASTHAN,SIKAR,Inactive,4.3,94
NR2-RJ-4705,SIKAR INSTITUTE OF MANAGEMENT,"SIKAR INSTITUTE OF MANAGEMENT, NEAR KIDS PLAY SCHOOL, TILAK NAGAR, RANI SATI ROAD, SIKAR, RAJASTHAN-332001",332001,NORTH TWO,RAJASTHAN,SIKAR,Active,4.8,4
NR2-RJ-4767,VINAYAK SR.SEC. SCHOOL,"VINAYAK SR. SEC. SCHOOL, SHASTRI NAGAR, RANI SATI ROAD, SIKAR (RAJASTHAN) 332001, LANDMARK-MURLI PLAZA",332001,NORTH TWO,RAJASTHAN,SIKAR,Active,4.1,48
NR2-RJ-4772,VARDHMAN SHIKSHAK PRASHIKSHAN SANSTHAN,"JAIPUR BIKANER BYEPASS NH-52 GOKULPURA, SIKAR",332001,NORTH TWO,RAJASTHAN,SIKAR,Active,4.1,33
NR2-RJ-4461,S P COLLEGE,"SARVDHAM TEMPLE, NEAR POLICE LANE, 307001",307001,NORTH TWO,RAJASTHAN,SIROHI,Active,Govt. Venues/IITs/IIMs,Govt. Venues/IITs/IIMs
NR2-RJ-4228,BRIGHTLANDS IT HUB,"C/O BRIGHTLANDS CONVENT SCHOOL, PADAMPUR BYPASS, 4ML, 335001",335001,NORTH TWO,RAJASTHAN,SRIGANGANAGAR,Inactive,4.9,102
NR2-RJ-4229,JAIN IT SOLUTIONS,"C/O JAIN PRIVATE ITI, SSB ROAD, NEAR SSB OFFICE, 335001",335001,NORTH TWO,RAJASTHAN,SRIGANGANAGAR,Inactive,4,7
NR2-RJ-4230,SHRI AATM VALLABH JAIN GIRLS COLLEGE,"SUDAMA NAGAR, HANUMANGARH ROAD, 335001",335001,NORTH TWO,RAJASTHAN,SRIGANGANAGAR,Active,4.3,4
NR2-RJ-4231,SURENDERA GROUP OF INSTITUTION,"HIS HIGHNESS GARDEN, POWER HOUSE ROAD, SADULSHAHAR ROAD, 335001",335001,NORTH TWO,RAJASTHAN,SRIGANGANAGAR,Active,3.9,3
NR2-RJ-4482,MARWAR IT COMPUTER AND COMMERCE COACHING,"BEHIND MANSROWER HOTEL, TEHSIL ROAD, SUMERPUR, 306902",306902,NORTH TWO,RAJASTHAN,SUMERPUR,Inactive,Govt. Venues/IITs/IIMs,Govt. Venues/IITs/IIMs
NR2-RJ-4462,DR K N MODI UNIVERSITY,"INS-1, RIICO INDUSTRIAL AREA, PHASE-2, NIWAI, 304021",304021,NORTH TWO,RAJASTHAN,TONK,Inactive,-,-
NR2-RJ-4501,SHARMA TECHNICAL & MANAGEMENT INSTITUTE,"INFRONT OF OLD CHUNGI NAKA, CHHAWNI CHOURAHA, 304001",304001,NORTH TWO,RAJASTHAN,TONK,Inactive,Govt. Venues/IITs/IIMs,Govt. Venues/IITs/IIMs
NR2-RJ-4547,SEWANAND COLLEGE TONK,"NH- 12, SONVA TOLL PLAZA KE PASS, USMANPURA, 304001",304001,NORTH TWO,RAJASTHAN,TONK,Active,-,-
NR2-RJ-4646,SEWANAND ITI TONK,"NEAR SAWAI MADHOPUR CHORAHA OVER BRIDGE, SHRINATH COLONY , NH- 552, TONK, RAJASTHAN- 304001",304001,NORTH TWO,RAJASTHAN,TONK,Active,4,4
NR2-RJ-4232,BUDDHA GROUP OF INSTITUTIONS,"SETH JI KI KUNDAL, NH-48, OPP. COUNTRY CLUB, BALICHA, UDAIPUR, 313001",313001,NORTH TWO,RAJASTHAN,UDAIPUR,Inactive,3.3,129
NR2-RJ-4233,EKLAVYA ACADEMY,"UMARDA MAIN ROAD, RANI JI KI BAWRI, NEAR AHMEDABAD BYPAAS, KALADWAS, 313001",313001,NORTH TWO,RAJASTHAN,UDAIPUR,Inactive,3.4,98
NR2-RJ-4234,HINT- HARDWARE INSTITUTE OF NETWORK TECHNOLOGY,"11, SWAMI NAGAR, BEHIND CELEBRATION MALL, NEAR NILKANTH HOSPITAL, 313004",313004,NORTH TWO,RAJASTHAN,UDAIPUR,Inactive,-,-
NR2-RJ-4235,SS COLLEGE OF ENGINEERING,"SS HILLS MAIN JHAMAR KOTRA ROAD UMARDA, ADARSH NAGAR, UDAIPUR, RAJASTHAN 313001",313001,NORTH TWO,RAJASTHAN,UDAIPUR,Inactive,3.5,3
NR2-RJ-4514,BUDDHA GROUP OF INSTITUTIONS,"SETH JI KI KUNDAL, NH-48, OPP. COUNTRY CLUB, BALICHA, 313003",313003,NORTH TWO,RAJASTHAN,UDAIPUR,Active,3.3,3
NR2-RJ-4515,TECHNO INDIA NJR INSTITUTE OF TECHNOLOGY,"SPL-T, RIICO, INDUSTRIAL AREA, KALADWAS, 313003",313003,NORTH TWO,RAJASTHAN,UDAIPUR,Inactive,5,1
NR2-RJ-4583,SHRI BALAJI COLLEGE OF NURSING,"AHEAD GAYATRI PETROL PUMP, JHAMAR KOTRA MAIN ROAD, HOTEL ROHAN PALACE KI GALI, H.M.SECTOR -5, UDAIPUR, RAJASTHAN-313002",313002,NORTH TWO,RAJASTHAN,UDAIPUR,Active,4.2,4
NR2-RJ-4591,BALAJI POLYTECHNIC COLLEGE ONLINE EXAM CENTRE,"AIRPORT ROAD, NEAR TRANSPORT NAGAR, DEBARI, UDAIPUR, RAJASTHAN- 313024",313024,NORTH TWO,RAJASTHAN,UDAIPUR,Active,3.8,3
NR2-UP-4716,JAIPURIA INSTITUTE OF MANAGEMENT-NOIDA,"A-32A, OPPOSITE IBM INDIA, BLOCK A, INDUSTRIAL AREA, SECTOR 62, NOIDA, UTTAR PRADESH 201309",201309,NORTH TWO,UTTAR PRADESH,GAUTAM BUDDHA NAGAR,Inactive,4.3,308
NR2-UP-4743,OM GROUP ONLINE EXAMINATION CENTRE,"PLOT 11/1, KNOWLEDGE PARK-3, GREATER NOIDA, GAUTAM BUDH NAGAR, OPPOSITE DELHI PUBLIC WORLD SCHOOL, GREATER NOIDA, UTTAR PRADESH 201301",201301,NORTH TWO,UTTAR PRADESH,GAUTAM BUDDHA NAGAR,Inactive,3.3,3
NR2-UP-1725,AYESHA PUBLIC SCHOOL,"PLOT NO Â€“ 756, NH-24, HAPUR ROAD, MASURI, GHAZIABAD (UÆ©AR PRADESH) PIN CODE - 201015",201014,NORTH TWO,UTTAR PRADESH,GHAZIABAD,Inactive,3,3
NR2-UP-1765,INSTITUTE OF PRODUCTIVITY & MANAGEMENT,"INSTITUTE OF PRODUCTIVITY & MANAGEMENT, DELHI-MEEMT RD, NEAR DUHAI METRO STATION GHAZIABAD, UTTAR PRADESH 201206",201206,NORTH TWO,UTTAR PRADESH,GHAZIABAD,Inactive,4.8,4
NR2-UK-4236,NANDA DEVI INFOTECH SOLUTION,"ALMORA, UTTARAKHAND",Pincode Missing,NORTH TWO,UTTARAKHAND,ALMORA,Inactive,5,1
NR2-UK-4490,GOVT ITI ALMORA,"GOVT ITI ALMORA, ALMORA, 263601",263601,NORTH TWO,UTTARAKHAND,ALMORA,Active,Govt. Venues/IITs/IIMs,Govt. Venues/IITs/IIMs
NR2-UK-4396,"PRADHANMANTRI KAUSHAL VIKAS KENDRA,BAGESHWAR","PINDARI GLACIER ROAD, KATHYABARA, 263642",263642,NORTH TWO,UTTARAKHAND,BAGESHWAR,Inactive,Govt. Venues/IITs/IIMs,Govt. Venues/IITs/IIMs
NR2-UK-4488,GOVT ITI KANDA,"GOVT. INDUSTRIAL TRAINING INSTITUTE KANDA-BAGESHWAR, 263631",263631,NORTH TWO,UTTARAKHAND,BAGESHWAR,Active,Govt. Venues/IITs/IIMs,Govt. Venues/IITs/IIMs
NR2-UK-4502,GOVT INDUSTRIAL TRAINING INSTITUTE BAGESHWAR (SAMAJ KALYAN),"GOVT. INDUSTRIAL TRAINING INSTITUTE BAGESHWAR (SAMAJ KALYAN), 263669",263669,NORTH TWO,UTTARAKHAND,BAGESHWAR,Active,Govt. Venues/IITs/IIMs,Govt. Venues/IITs/IIMs
NR2-UK-4479,"GOVT INDUSTRIAL TRAINING INSTITUTE CHAMBA, UTTARAKHAND","HADAM TALL, VILLAGE ARAAKOT,CHAMBA, DISTT-NEW TIHRI, 249145",249145,NORTH TWO,UTTARAKHAND,Chamba,Inactive,Govt. Venues/IITs/IIMs,Govt. Venues/IITs/IIMs
NR2-UK-4237,INSTITUTE OF TECHNOLOGY,"KOTHIYAL SAIN,GOPESHWAR CHAMOLI ROAD, 246424",246424,NORTH TWO,UTTARAKHAND,CHAMOLI,Inactive,4.8,77
NR2-UK-4678,GOVT INDUSTRIAL TRAINING INSTITUTE GOPESHWAR,"GOPESHWAR, CHAMOLI GOPESHWAR, UTTARAKHAND 246401",246401,NORTH TWO,UTTARAKHAND,CHAMOLI,Active,Govt. Venues/IITs/IIMs,Govt. Venues/IITs/IIMs
NR2-UK-4679,GOVT INDUSTRIAL TRAINING INSTITUTE KARANPRAYAG,"KARANPRAYAG NAGKOT RD, KARNAPRAYAG, UTTARAKHAND 246446",246446,NORTH TWO,UTTARAKHAND,CHAMOLI,Active,Govt. Venues/IITs/IIMs,Govt. Venues/IITs/IIMs
NR2-UK-4238,GOLJU INFOTECH SOLUTION,"CHAMPAWAT, UTTARAKHAND",Pincode Missing,NORTH TWO,UTTARAKHAND,CHAMPAWAT,Inactive,2,1
NR2-UK-4463,GOVT ITI TANAKPUR,"GOVT ITI TANAKPUR, DISTT- CHAMPAWAT., 263309",263309,NORTH TWO,UTTARAKHAND,CHAMPAWAT,Active,Govt. Venues/IITs/IIMs,Govt. Venues/IITs/IIMs
NR2-UK-4677,GOVT ITI CHAMPAWAT,"GOVT ITI, CHAMPAWAT, UTTARAKHAND 262523",262523,NORTH TWO,UTTARAKHAND,CHAMPAWAT,Active,Govt. Venues/IITs/IIMs,Govt. Venues/IITs/IIMs
NR2-UK-4485,DR SUSHILA TIWARI COLLEGE OF ADVANCE STUDIES,"DEHRADOON, UTTARAKHAND",Pincode Missing,NORTH TWO,UTTARAKHAND,DEHRADOON,Inactive,4.5,20
NR2-UK-4239,APOLLO ONLINE EXAMINATION,"DEHRADUN, UTTARAKHAND",Pincode Missing,NORTH TWO,UTTARAKHAND,DEHRADUN,Inactive,4.5,299
NR2-UK-4240,AVIRAL EDUCATION,"DEHRADUN, UTTARAKHAND",Pincode Missing,NORTH TWO,UTTARAKHAND,DEHRADUN,Inactive,4.4,557
NR2-UK-4241,DD COLLEGE GARHI,"DD COLLEGE, 25 NIMBUWALA,GARHI CANTT, NEAR ONGC HELIPAD,, 248003",248003,NORTH TWO,UTTARAKHAND,DEHRADUN,Active,3.9,88
NR2-UK-4242,DIMT,"DEHRADUN, UTTARAKHAND",Pincode Missing,NORTH TWO,UTTARAKHAND,DEHRADUN,Inactive,4.2,145
NR2-UK-4243,DIT UNIVERSITY,"MUSSORIE DIVERSION, DEHRADUN, UTTARAKHAND, 248009",248009,NORTH TWO,UTTARAKHAND,DEHRADUN,Active,4,1568
NR2-UK-4244,GRAPHIC ERA UNIVERSITY,"566/6,BELL ROAD,CLEMENTOWN, 248002",248002,NORTH TWO,UTTARAKHAND,DEHRADUN,Active,3.9,2517
NR2-UK-4245,GRD INSTITUTES,"214, RAJPUR ROAD, DEHRADUN, UTTARAKHAND, 248001",248001,NORTH TWO,UTTARAKHAND,DEHRADUN,Active,3.4,630
NR2-UK-4246,HIMGIRI DIGITAL,"DEHRADUN, UTTARAKHAND",Pincode Missing,NORTH TWO,UTTARAKHAND,DEHRADUN,Inactive,2.9,10
NR2-UK-4247,IMMT COLLEGE OF MEDIA MANAGEMENT AND AGRO SCIENCES,"DEHRADUN, UTTARAKHAND",Pincode Missing,NORTH TWO,UTTARAKHAND,DEHRADUN,Inactive,3.7,45
NR2-UK-4248,JB INSTITUTE OF TECHNOLOGY,"JBIT, NH-07,VILLAGE SHANKARPUR,NEAR SAHASPUR,CHAKRATA ROAD,, 248197",248197,NORTH TWO,UTTARAKHAND,DEHRADUN,Active,3.9,3
NR2-UK-4249,MAYA INSTITUTE,"DEHRADUN, UTTARAKHAND",Pincode Missing,NORTH TWO,UTTARAKHAND,DEHRADUN,Inactive,3.8,483
NR2-UK-4250,JAGANNATH VISHWA COLLEGE,"MAJRI GRANT,LAL TAPPAR (NEAR SAI MANDIR LANE),FUN VALLEY,, 248140",248140,NORTH TWO,UTTARAKHAND,DEHRADUN,Active,3.7,574
NR2-UK-4251,PRAKRITI VALLEY SCHOOL,"DEHRADUN, UTTARAKHAND",Pincode Missing,NORTH TWO,UTTARAKHAND,DEHRADUN,Inactive,-,-
NR2-UK-4252,SHIWALIK COLLEGE OF ENGINEERING,"DEHRADUN, UTTARAKHAND",Pincode Missing,NORTH TWO,UTTARAKHAND,DEHRADUN,Inactive,4.1,632
NR2-UK-4253,SHRI DEV BHUMI INSTITUTE OF TECHNOLOGY,"DEHRADUN, UTTARAKHAND",Pincode Missing,NORTH TWO,UTTARAKHAND,DEHRADUN,Inactive,3.8,321
NR2-UK-4254,SIDDHARTHA ONLINE_SOLUTIONS,"DEHRADUN, UTTARAKHAND",Pincode Missing,NORTH TWO,UTTARAKHAND,DEHRADUN,Inactive,2.8,25
NR2-UK-4255,SKILL SHARE MANAGEMENT,"DEHRADUN, UTTARAKHAND",Pincode Missing,NORTH TWO,UTTARAKHAND,DEHRADUN,Inactive,3.5,61
NR2-UK-4256,TULA'S INSTITUTE,"DEHRADUN, UTTARAKHAND",Pincode Missing,NORTH TWO,UTTARAKHAND,DEHRADUN,Inactive,3.9,1273
NR2-UK-4257,VEDIC EDUTECH(E-SCHOOL),"DEHRADUN, UTTARAKHAND",Pincode Missing,NORTH TWO,UTTARAKHAND,DEHRADUN,Inactive,3.7,87
NR2-UK-4475,ISHAN INFOTECH,"DEHRADUN, UTTARAKHAND",Pincode Missing,NORTH TWO,UTTARAKHAND,DEHRADUN,Inactive,5,102
NR2-UK-4476,DEV PRAYAG INSTITUTE OF TECHNOLOGY,"DEHRADUN, UTTARAKHAND",Pincode Missing,NORTH TWO,UTTARAKHAND,DEHRADUN,Inactive,3.2,10
NR2-UK-4482,PASHUPATI CONSULTANCY AND SOLUTIONS PVT LTD,"PLOT NO 25, DEHRADUN, UTTARAKHAND, 248001",248001,NORTH TWO,UTTARAKHAND,DEHRADUN,Inactive,3.2,35
NR2-UK-4483,INSTITUTE OF TECHNOLOGY & MANAGEMENT,"60, CHAKRATA ,YAMUNA COLONY, CONNAUGHT PLACE, 248001",248001,NORTH TWO,UTTARAKHAND,DEHRADUN,Active,4.8,4
NR2-UK-4484,NIMBUS ACADEMY OF MANAGEMENT,"NH-72, JHAJRA, CHAKRATA ROAD, P.O. SUDDHOWALA, 248007",248007,NORTH TWO,UTTARAKHAND,DEHRADUN,Active,3.9,300
NR2-UK-4486,SIDDHARTHA GROUP OF INSTITUTIONS COMPUTER LAB,"SIDDHARTHA LAW & GROUP OF INSTITUTION ,DANDA KHUDANEWALA,SAHASTRADHARA ROAD, 248001",248001,NORTH TWO,UTTARAKHAND,DEHRADUN,Inactive,3.6,244
NR2-UK-4491,DOON GHATI COLLEGE,"NEAR SUGAR MILL, DOIWALA, 248140",248140,NORTH TWO,UTTARAKHAND,DEHRADUN,Inactive,3.9,88
NR2-UK-4492,ST XAVIERS SCHOOL,"CANAL ROAD, DHORAN RD, 248001",248001,NORTH TWO,UTTARAKHAND,DEHRADUN,Inactive,4.4,300
NR2-UK-4496,ST JOHNS DIGITAL ACADEMY,"ST. JOHN Ã¢Â„Â¢S ACADEMY, LOWER NEHRU GRAM, DEHRADUN UTTARAKHAND,, 248014",248014,NORTH TWO,UTTARAKHAND,DEHRADUN,Active,-,-
