dms_code,venue_name,venue_address,pincode,region,state,city,status,google_ratings,google_review_count
STH-TN-5751,ST MARIAM POLYTECHNIC COLLEGE,"VG2J+C54, TENKASI TIRUNELVELI ROAD, ALANGULAM, SIVALARKULAM VILLAGE, TIRUNELVELI, TAMIL NADU 627851",627851,SOUTH,TAMIL NADU,TENKASI,Inactive,2.9,111
STH-TN-5752,M S P VELAYUTHA NADAR LAKSHMI THAIAMMAL POLYTECHNIC COLLEGE,"50/2 , PAVOORCHATRAM , SIVAGAMIPURAM , ALANGULAM 6227808",627808,SOUTH,TAMIL NADU,TENKASI,Active,4,4
STH-TN-5774,GOVT ITI-KADAYANALLUR,"SHENKOTTAI - KADAYANALLUR RD, KADAYANLLUR, TAMIL NADU - 627751",627751,SOUTH,TAMIL NADU,TENKASI,Inactive,Govt. Venues/IITs/IIMs,Govt. Venues/IITs/IIMs
STH-TN-5775,GOVT ITI-VEERAKERALAMPUDUR,"1D/9, ALANGULAM - SURANDAI ROAD, VEERAKERALAMPUDUR, TIRUNELVELI - 627861",627861,SOUTH,TAMIL NADU,TENKASI,Inactive,Govt. Venues/IITs/IIMs,Govt. Venues/IITs/IIMs
STH-TN-5835,AMAR SEVA SARADHAMBAL ITI-AYIKUDI,"AMAR SEVA SANGAM SARADAMBAL ITI,10-2, 163, SULOCHANA GARDENS, TENKASI ROAD, AYIKUD TENKASI DISTRICT-627852",627852,SOUTH,TAMIL NADU,TENKASI,Inactive,Govt. Venues/IITs/IIMs,Govt. Venues/IITs/IIMs
STH-TN-5836,EVEREST ITI-KADAYANALLUR,"EVEREST PRIVATE INDUSTRIAL TRAINING INSTITUTE,P.B.NO.2, MAIN ROAD, KADAYANALLUR TENKASI DISTRICT-627751",627751,SOUTH,TAMIL NADU,TENKASI,Inactive,Govt. Venues/IITs/IIMs,Govt. Venues/IITs/IIMs
STH-TN-5849,AMAR SEVA SARADHAMBAL ITI AYIKUDI,"AMAR SEVA SANGAM SARADAMBAL ITI,10-2, 163, SULOCHANA GARDENS, TENKASI ROAD, AYIKUD TENKASI DISTRICT-627852",627852,SOUTH,TAMIL NADU,TENKASI,Inactive,-,-
STH-TN-5850,"EVEREST ITI, KADAYANALLUR","EVEREST PRIVATE INDUSTRIAL TRAINING INSTITUTE,P.B.NO.2, MAIN ROAD, KADAYANALLUR TENKASI DISTRICT-627751",627751,SOUTH,TAMIL NADU,TENKASI,Inactive,Govt. Venues/IITs/IIMs,Govt. Venues/IITs/IIMs
STH-TN-5244,AVC COLLEGE OF ENGINEERING,"MAYILADUTHURAI - AKKUR RD, MANNAMPANDAL, MAYILADUTHURAI, TAMIL NADU 609305",609305,SOUTH,TAMIL NADU,THANJAVUR,Inactive,-,-
STH-TN-5245,ST JOSEPH'S COLLEGE OF ENGINEERING & TECHHNOLOGY,"A.S NAGAR, ELUPATTI, THANJAVUR 613403.",613403,SOUTH,TAMIL NADU,THANJAVUR,Inactive,3.9,600
STH-TN-5246,ARASU ENGINEERING COLLEGE,"CHENNAI MAIN ROAD, KONDANGUDI, KUMBAKONAM, THANJAVUR 612 501, 612501",612501,SOUTH,TAMIL NADU,THANJAVUR,Active,3.5,3
STH-TN-5247,BON SECOURS COLLEGE FOR WOMEN,"VILLAR RD, THANJAVUR, TAMIL NADU 613006",613006,SOUTH,TAMIL NADU,THANJAVUR,Black listed,3.7,50
STH-TN-5248,PRIST UNIVERSITY,"TRICHY THANJAVUR ROAD, VALLAM, CAFE ROAD, TAMIL NADU 613403",613403,SOUTH,TAMIL NADU,THANJAVUR,Active,3.7,3
STH-TN-5376,KSK COLLEGE OF ENGINEERING AND TECHNOLOGY,"RIVER BRIDGE 45C, DHARASURAM POST, KUMBAKONAM 612 702, THANJAVUR DISTRICT,, 612702",612702,SOUTH,TAMIL NADU,THANJAVUR,Active,3.7,3
STH-TN-5401,GOVERNMENT COLLEGE OF ENGINEERING-THANJAVUR,"GANDHARVAKOTTAI ROAD,SENGIPATTI TO GANDHARVAKOTTAI MAINROAD, SENGIPATTI,THANJAVUR-613402",613402,SOUTH,TAMIL NADU,THANJAVUR,Inactive,Govt. Venues/IITs/IIMs,Govt. Venues/IITs/IIMs
STH-TN-5601,"SRI CHOZHA PVT ITI, KUMBAKONAM","PILLAYAM PETTAI, KUMBAKONAM, TAMIL NADU 612103",612013,SOUTH,TAMIL NADU,THANJAVUR,Active,Govt. Venues/IITs/IIMs,Govt. Venues/IITs/IIMs
STH-TN-5602,"ST XAVIER S PVT ITI, THANJAVUR","MARY'S CORNER, NANJIKOTTAI RD, THANJAVUR, TAMIL NADU 613001",613001,SOUTH,TAMIL NADU,THANJAVUR,Inactive,Govt. Venues/IITs/IIMs,Govt. Venues/IITs/IIMs
STH-TN-5735,PATTUKKOTTAI CO-OPERATIVE INDUSTRIAL TRAINING INSTITUTE,"NEAR TALUK OFFICE, MUTHUPET ROAD, NADIMUTHU NAGAR (PO), PATTUKKOTTAI, THANJAVUR - 614602.",614602,SOUTH,TAMIL NADU,THANJAVUR,Active,Govt. Venues/IITs/IIMs,Govt. Venues/IITs/IIMs
STH-TN-5765,GOVT ITI FOR WOMEN-KARIKAL,"TR PATTINAM, KARAIKAL 609606.",609606,SOUTH,TAMIL NADU,THANJAVUR,Active,Govt. Venues/IITs/IIMs,Govt. Venues/IITs/IIMs
STH-TN-5792,PERIYAR MANIAMMAI INSTITUTE OF SCIENCE & TECHNOLOGY,"PERIYAR NAGAR, VALLAM, THANJAVUR, TAMIL NADU 613403",613403,SOUTH,TAMIL NADU,THANJAVUR,Active,4.1,4
STH-TN-5793,UNIVERSITY COLLEGE OF ENGINEERING-PATTUKKOTTAI,"ECR ROAD, RAJAMADAM, PATTUKKOTTAI TALUK, THANJAVUR DISTRICT 614701",614701,SOUTH,TAMIL NADU,THANJAVUR,Active,4.2,4
STH-TN-5794,ST JOSEPHS COLLEGE OF ENGINEERING AND TECHNOLOGY,"A.S. NAGAR, ELUPATTI VILLAGE, RAWASPATTI POST, THANJAVUR DISTRICT 613403",613403,SOUTH,TAMIL NADU,THANJAVUR,Inactive,4,251
STH-TN-5795,INSTITUTE MANAGEMENT COMMITTEE OF GOVT ITI FOR WOMEN TRP,"GOVERNMENT ITI FOR WOMEN, TR PATTINAM, KARAIKAL 609606.",609606,SOUTH,TAMIL NADU,THANJAVUR,Active,Govt. Venues/IITs/IIMs,Govt. Venues/IITs/IIMs
STH-TN-5824,AS-SALAM COLLEGE OF ENGINEERING & TECHNOLOGY,"THIRUMANGALAKUDI, ADUTHURAI - TIRUPPANDAL ROAD, THANJAVUR, TAMIL NADU 612102",612102,SOUTH,TAMIL NADU,THANJAVUR,Inactive,4.5,470
STH-TN-5828,SRI ADHISANKARAR PRIVATE INDUSTRIAL TRAINING INSTITUTE,"SRI ADHISANKARAR PRIVATE INDUSTRIAL TRAINING INSTITUTE SRI ADHISANKARA ITI, 2ND STREET, VOC NAGAR, THANJAVUR, STATE: TAMIL NADU, PIN CODE: 613007",613007,SOUTH,TAMIL NADU,THANJAVUR,Inactive,Govt. Venues/IITs/IIMs,Govt. Venues/IITs/IIMs
STH-TN-5832,SRI ADHISANKARAR PRIVATE INDUSTRIAL TRAINING INSTITUTE-THANJAVUR,"SRI ADHISANKARAR PRIVATE INDUSTRIAL TRAINING INSTITUTE SRI ADHISANKARA ITI, 2ND STREET, VOC NAGAR, THANJAVUR, STATE: TAMIL NADU, PIN CODE: 613007",613007,SOUTH,TAMIL NADU,THANJAVUR,Inactive,Govt. Venues/IITs/IIMs,Govt. Venues/IITs/IIMs
STH-TN-5884,GOVERNMENT INDUSTRIAL TRAINING INSTITUTE-THANJAVUR,"NEW BUS STAND ROAD, NIRMALA NAGAR RESIDENTIAL AREA, THANJAVUR 613007.",613007,SOUTH,TAMIL NADU,THANJAVUR,Active,Govt. Venues/IITs/IIMs,Govt. Venues/IITs/IIMs
STH-TN-6031,GOVT ITI-ORATHANADU,"THIRUVONAM, ORATHANADU TK, TAMIL NADU 614614,",614614,SOUTH,TAMIL NADU,THANJAVUR,Inactive,4.3,6
STH-TN-6087,MUTHAYAMMAL ENGINEERING COLLEGE,"KAKKAVERI, RASIPURAM, NAMAKKAL DISTRICT - 637408",637408,SOUTH,TAMIL NADU,THANJAVUR,Active,3.7,837
STH-TN-6088,ANNAI COLLEGE OF ENGINEERING & TECHNOLOGY,"ANNAI COLLEGE OF ENGINEERING & TECHNOLOGY, KOVILACHERI, KUMBAKONAM-612503, THANJAVUR-DIST",612503,SOUTH,TAMIL NADU,THANJAVUR,Active,Closed,Closed
STH-TN-1685,JSS COLLEGE OF PHARMACY,"NEAR, ROSE GDN RD, DAVISDALE, OOTY, TAMIL NADU 643001, INDIA",643001,SOUTH,TAMIL NADU,THE NILGIRIS,Inactive,4.4,215
STH-TN-5377,CSI COLLEGE OF ENGINEERING,"KETTY, OOTY,TAMIL NADU 643215",643215,SOUTH,TAMIL NADU,THE NILGIRIS,Active,4.2,4
STH-TN-5603,"GOVERNMENT INDUSTRIAL TRAINING INSTITUTE, COONOOR","HIGH FIELD ROAD, NEAR SIMS PARK, COONOOR,ATTADI, THE NILIGRIS PIN: 643101",643101,SOUTH,TAMIL NADU,THE NILGIRIS,Active,Govt. Venues/IITs/IIMs,Govt. Venues/IITs/IIMs
STH-TN-5604,"GOVERNMENT INDUSTRIAL TRAINING INSTITUTE,GUDALUR","UPPATTI, PANDALUR GUDALUR, THE NIGIRIS 643241",643241,SOUTH,TAMIL NADU,THE NILGIRIS,Active,Govt. Venues/IITs/IIMs,Govt. Venues/IITs/IIMs
STH-TN-6011,PROVIDENCE COLLEGE FOR WOMEN-COONNOR,"SPRING FIELD, COONOOR, BANDISHOLA, TAMIL NADU 643104, INDIA",643103,SOUTH,TAMIL NADU,THE NILGIRIS,Active,4.3,4
STH-TN-1708,MARY MATHA COLLEGE OF ARTS AND SCIENCE,"PERIYAKULAM EAST 625604, NALLA KARUPPAN PATTI, TAMIL NADU - 625604",625604,SOUTH,TAMIL NADU,THENI,Inactive,4.2,384
STH-TN-5249,BHARATH NIKENTAN ENGINEERING COLLEGE,SRI GOWRI NAGAR THIMMARASANAICKANOOR AUNDIPATTY 625530,625530,SOUTH,TAMIL NADU,THENI,Active,3.9,3
STH-TN-5250,NADAR SARASWATHI COLLEGE OF ENGINEERING AND TECHNOLOGY,VADAPUDUPATTI THENI ALLINAGARAM TAMILNADU 625531,625531,SOUTH,TAMIL NADU,THENI,Inactive,3.7,300
STH-TN-5605,"GOVERNMENT INDUSTRIAL TRAINING INSTITUTE,THENI","NEAR IVAR BAKERY, MADURAI - THENI HWY, THENI, 625531",625531,SOUTH,TAMIL NADU,THENI,Inactive,Govt. Venues/IITs/IIMs,Govt. Venues/IITs/IIMs
STH-TN-5741,KALVI INTERNATIONAL PUBLIC SCHOOL,"DINDIGUL PERIYAKULAM NATIONAL HIGHWAY THANNEERPANTHAL, DEVATHANAPATTI, PERIYAKULAM, TAMIL NADU 625602",625602,SOUTH,TAMIL NADU,THENI,Active,-,-
STH-TN-5790,GOVT ITI-BODINAYAKKANUR,"UPPARPATTI, VEERAPANDI (POST), BODINAYAKANU_625534",625534,SOUTH,TAMIL NADU,THENI,Inactive,Govt. Venues/IITs/IIMs,Govt. Venues/IITs/IIMs
STH-TN-5805,THENI KAMMAVAR SANGAM COLLEGE OF TECHNOLOGY,"THENI MAIN ROAD, KODUVILLARPATTI POST, THENI DISTRICT 625534",625344,SOUTH,TAMIL NADU,THENI,Inactive,3.8,3
STH-TN-5806,GOVERNMENT ENGINEERING COLLEGE-THENI,"MELACHOKKANATHAPURAM, BODINAYAKKANUR, THENI DISTRICT 625 582, 625582",625582,SOUTH,TAMIL NADU,THENI,Inactive,Govt. Venues/IITs/IIMs,Govt. Venues/IITs/IIMs
STH-TN-5869,"GOVERNMENT INDUSTRIAL TRAINING INSTITUTE(WOMEN), AUNDIPATTI","AUNDIPATTI THENI MADURAI ROAD, S.RENGANATHAPURAM, AUNDIPATTITHENI, STATE:TAMIL NADU,, 625536",625536,SOUTH,TAMIL NADU,THENI,Inactive,Govt. Venues/IITs/IIMs,Govt. Venues/IITs/IIMs
STH-TN-6097,PERIYAR UNIVERSITY,"PERIYAR PALKALAI NAGAR, KARUPPUR, SALEM – 636 011",636011,SOUTH,TAMIL NADU,THENI,Active,3.8,1144
STH-TN-1699,J N N INSTITUTE OF TECHNOLOGY-THIRUVALLUR,"90, USHAA GARDEN, KANNIGAIPAIR, CHENNAI PERIYAPALAYAM HIGHWAY, KANNIGAIPAIR, TAMIL NADU 601102, INDIA",601102,SOUTH,TAMIL NADU,THIRUVALLUR,Active,4,486
STH-TN-1718,S A COLLEGE OF ARTS AND SCIENCE,"POONAMALLEE, AVADI RD, VEERARAGHAVAPURAM, THIRUVERKADU, CHENNAI, TAMIL NADU, 600077",600077,SOUTH,TAMIL NADU,THIRUVALLUR,Active,4.1,4
STH-TN-5252,PRATHYUSHA ENGINEERING COLLEGE,"ARANVOYALKUPPAM, POONAAMALLEE-TIRUVALLUR ROAD, TIRUVALLUR-602025",602025,SOUTH,TAMIL NADU,THIRUVALLUR,Black listed,3.8,600
STH-TN-5253,TJS ENGINEERING COLLEGE,"T.J.S.NAGAR, PERUVOYAL, NEAR KAVARAIPETTAI, GUMMIDIPOONDI, TIRUVALLUR-601206",601206,SOUTH,TAMIL NADU,THIRUVALLUR,Black listed,3.8,500
STH-TN-5254,VELAMMAL INSTITUTE OF TECHNOLOGY,"CHENNAI-KOLKATTA HIGHWAY, PANCHETTI, TIRUVALLUR-601204",601204,SOUTH,TAMIL NADU,THIRUVALLUR,Active,3.7,3
STH-TN-5255,LOYOLA INSTITUTE OF TECHNOLOGY,"MEVALOORKUPPAM, B VILLAGE, PALANCHOOR, NAZARETHPET POST, CHENNAI 600123",600123,SOUTH,TAMIL NADU,THIRUVALLUR,Active,4,210
STH-TN-5256,VEL TECH RANGARAJAN DR SKUNTHALA R&D INSTITUTE OF SCIENCE AND TECHNOLOGY,"NO.42,AVADI-VELTECH ROAD,VELNAGAR,AVADI,CHENNAI 600062",600062,SOUTH,TAMIL NADU,THIRUVALLUR,Active,4.1,1500
STH-TN-5378,AALIM MOHAMMAD SALEGH ENGINEERING COLLEGE,"NIZARA EDUCATIONAL CAMPUS, MUTHAPUDUPET, AVADI, IAF, CHENNAI, TAMIL NADU 600055",600055,SOUTH,TAMIL NADU,THIRUVALLUR,Active,3.9,3
STH-TN-5606,"GOVERNMENT INDUSTRIAL TRAINING INSTITUTE, AMBATTUR","TIRUPATI RD, MANGALAPURAM, SIDCO INDUSTRIAL ESTATE, AMBATTUR, CHENNAI, TAMIL NADU 600053",600053,SOUTH,TAMIL NADU,THIRUVALLUR,Active,Govt. Venues/IITs/IIMs,Govt. Venues/IITs/IIMs
STH-TN-5607,"GOVERNMENT INDUSTRIAL TRAINING INSTITUTE,ARAKKONAM","THIRUVALLUR RD,ARAKKONAM, TAMIL NADU 631004",631004,SOUTH,TAMIL NADU,THIRUVALLUR,Active,Govt. Venues/IITs/IIMs,Govt. Venues/IITs/IIMs
STH-TN-5703,R M D ENGINEERING COLLEGE,"RMD COLLEGE RD, KAVARAIPETTAI,THIRUVALLUR, STATE: TAMILNADU, PIN CODE: 601206",601206,SOUTH,TAMIL NADU,THIRUVALLUR,Active,4.1,1000
STH-TN-5704,R M K ENGINEERING COLLEGE,"RSM NAGAR, GUMMIDIPOONDI, TALUK, KAVARAIPETTAI, THIRUVALLUR, STATE: TAMILNADU, PIN CODE: 601206",601206,SOUTH,TAMIL NADU,THIRUVALLUR,Active,4.2,1500
STH-TN-5725,TJS ENGINEERING COLLEGE,"TJS NAGAR, PERUVOYAL, KAVARAPETTAI-601206",601206,SOUTH,TAMIL NADU,THIRUVALLUR,Active,4.2,298
STH-TN-5726,TJS POLYTECHNIC COLLEGE,"TJS NAGAR, PERUVOYAL, KAVARAPETTAI-601206",601206,SOUTH,TAMIL NADU,THIRUVALLUR,Active,-,-
STH-TN-5768,DREAM INDIA PRIVATE INDUSTRIAL TRAINING INSTITUTE,"5,ANNAI THERASA STREET, CHINNA IKKDU ROAD, THIRUVALLUR, 602001",602001,SOUTH,TAMIL NADU,THIRUVALLUR,Active,Govt. Venues/IITs/IIMs,Govt. Venues/IITs/IIMs
STH-TN-5875,"GOVERNMENT INDUSTRIAL TRAINING INSTITUTE FOR WOMENS, AMBATTUR","TIRUPATI RD, MANGALAPURAM, SIDCO INDUSTRIAL ESTATE, AMBATTUR, CHENNAI, TAMIL NADU 600053",600053,SOUTH,TAMIL NADU,THIRUVALLUR,Active,Govt. Venues/IITs/IIMs,Govt. Venues/IITs/IIMs
STH-TN-5955,ROTARY CLUB OF MADRAS WORTH PRIVATE ITI-THIRUVALLUR,"ROTARY CLUB OF MADRAS CHARITABLE TRUST, PANJALAI V,THIRUVALLUR TAMIL NADU 601202",601202,SOUTH,TAMIL NADU,THIRUVALLUR,Active,Govt. Venues/IITs/IIMs,Govt. Venues/IITs/IIMs
STH-TN-6098,NEXT STEP ACDEMIC SOLUTIONS,"KUPPAN CHETTY STREET, NEW SCHEME ROAD, THENI, TAMIL NADU 625531",625531,SOUTH,TAMIL NADU,THIRUVALLUR,Active,4,4
STH-TN-6099,SRI JAYARAM INSTITUTE OF ENGINEERING AND TECHNOLOGY,"51 N,ELAVUR, 58 N.NATHAM,GUMMIDIPOONDI,THIRUVALLUR - 601201,TAMIL NADU, INDIA",601201,SOUTH,TAMIL NADU,THIRUVALLUR,Active,3.2,71
STH-TN-1713,CENTRAL UNIVERSITY OF TAMILNADU,"CENTRAL UNIVERSITY-NEELAKUDY ROAD, THIRUVARUR, TAMIL NADU - 610005",610005,SOUTH,TAMIL NADU,THIRUVARUR,Active,4.2,599
STH-TN-5608,"PADMA NARASIMHAN PVT ITI, MANJAKUDI","KEEZHA PALAIYUR ROAD, MANJAKKUDI, 612610",612610,SOUTH,TAMIL NADU,THIRUVARUR,Active,Govt. Venues/IITs/IIMs,Govt. Venues/IITs/IIMs
STH-TN-5994,SENGAMALA THAYAAR EDUCATIONAL TRUST (STET) WOMEN'S COLLEGE,"SUNDARAKOTTAI, TAMIL NADU 614016, INDIA",614016,SOUTH,TAMIL NADU,THIRUVARUR,Inactive,4.2,412
STH-TN-5609,DEVENDRA PRIVATE INDUSTRIAL TRAINING CENTRE,"OTTUDANPATTI, TAMIL NADU 628303",628303,SOUTH,TAMIL NADU,THOOTHUKKUDI,Inactive,Govt. Venues/IITs/IIMs,Govt. Venues/IITs/IIMs
STH-TN-5610,"GOVERNMENT INDUSTRIAL TRAINING INSTITUTE, TIRUCHENDUR","TIRUCHENDUR, THOOTHUKKUDI(DISTRICT), TAMIL NADU- 628216",628216,SOUTH,TAMIL NADU,THOOTHUKKUDI,Inactive,Govt. Venues/IITs/IIMs,Govt. Venues/IITs/IIMs
STH-TN-5611,"GOVERNMENT INDUSTRIAL TRAINING INSTITUTE,THOOTHUKUDI","PALAYAMKOTTAI ROAD, NH-7A, KORAMPALLAM, THOOTHUKUDI, TAMIL NADU 628101",628101,SOUTH,TAMIL NADU,THOOTHUKKUDI,Inactive,Govt. Venues/IITs/IIMs,Govt. Venues/IITs/IIMs
STH-TN-5612,"UMARUPULAVAR GOVERNMENT INDUSTRIAL TRAINING INSTITUTE,NAGALAPURAM","V. PUDUR, TAMIL NADU 628904",628904,SOUTH,TAMIL NADU,THOOTHUKKUDI,Inactive,Govt. Venues/IITs/IIMs,Govt. Venues/IITs/IIMs
STH-TN-5748,GRACE COLLEGE OF ENGINEERING,"HWP COLONY, MULLAKADU, THOOTHUKUDI, TAMIL NADU 628005",628005,SOUTH,TAMIL NADU,THOOTHUKUDI,Active,4.4,4
STH-TN-5776,GOVT ITI-VEPPALODAI,"VEPPALODAI, THOOTHUKUDI, TAMILNADU - 628903",628903,SOUTH,TAMIL NADU,THOOTHUKUDI,Inactive,Govt. Venues/IITs/IIMs,Govt. Venues/IITs/IIMs
STH-TN-5800,INFANT JESUS COLLEGE OF ENGINEERING,"THOOTHUKUDI NATIONAL HIGHWAY, NH-7A, KAMARAJAR NAGAR, KEELA, VALLANADU, TAMIL NADU 628851",628851,SOUTH,TAMIL NADU,THOOTHUKUDI,Active,4,4
STH-TN-5834,VINNARASI PRIVATE INDUSTRIAL TRAINING INSTITUTE-THOOTHUKUDI,"VINNARASI PRIVATE INDUSTRIAL TRAINING INSTITUTE,KADAMPUR ROAD, KAYATHARTHOOTHUKUDI DISTRICT-628952",628952,SOUTH,TAMIL NADU,THOOTHUKUDI,Inactive,Govt. Venues/IITs/IIMs,Govt. Venues/IITs/IIMs
STH-TN-5848,VINNARASI PRIVATE INDUSTRIAL TRAINING INSTITUTE,"VINNARASI PRIVATE INDUSTRIAL TRAINING INSTITUTE,KADAMPUR ROAD, KAYATHARTHOOTHUKUDI DISTRICT-628952",628952,SOUTH,TAMIL NADU,THOOTHUKUDI,Inactive,Govt. Venues/IITs/IIMs,Govt. Venues/IITs/IIMs
STH-TN-5268,DHANALAKSHMI SRINIVASAN UNIVERSITY,"SAMAYAPURAM(NEAR SAMAYAPURAM TOLL PLAZZA), CHENNAI-TRICHY MAIN ROAD, TIRUCHIRAPPALLI DISTRICT 621112",621112,SOUTH,TAMIL NADU,TIRUCHIRAPALLI,Inactive,4.1,41
STH-TN-5269,KONGUNADU COLLEGE OF ENGINEERING AND TECHNOLOGY,"NAMAKKAL-TRICHY MAIN ROAD, THOLURPATTI POST,THOTTIAM TALUK,TRICHY(DT)-621215",621215,SOUTH,TAMIL NADU,TIRUCHIRAPALLI,Inactive,4.4,1986
STH-TN-5270,KONGUNADU POLYTECHNIC COLLEGE,"NAMAKKAL-TRICHY MAIN ROAD, THOLURPATTI POST,THOTTIAM TALUK,TRICHY(DT)-621215",621215,SOUTH,TAMIL NADU,TIRUCHIRAPALLI,Inactive,4.4,1986
STH-TN-5271,MAM SCHOOL OF ENGINEERING,"TRICHY-CHENNAI TRUNK ROAD, SIRUGANUR, TRICHY, TAMIL NADU 621105",621105,SOUTH,TAMIL NADU,TIRUCHIRAPALLI,Active,3.8,3
STH-TN-5272,NATIONAL INSTITUTE OF TECHNOLOGY,"TANJORE MAIN ROAD, NH67, NEAR BHEL, TIRUCHIRAPPALLI, TAMIL NADU 620015",620015,SOUTH,TAMIL NADU,TIRUCHIRAPALLI,Inactive,3.7,57
STH-TN-5273,SARANATHAN COLLEGE OF ENGINEERING,"VENKATESWARA NAGAR, TRICHY - MADURAI HWY, PANJAPPUR, TRICHY, TAMIL NADU 620012",620012,SOUTH,TAMIL NADU,TIRUCHIRAPALLI,Inactive,4.1,1200
STH-TN-5274,SESHAYEE INSTITUTE OF TECHNOLOGY,"10 THANJAVUR ROAD KAMARAJ NAGAR,INDUSTRIAL COLONY(PO), ARIYAMANGALAM AREA, TIRUCHIRAPPALLI, TAMIL NADU 620010",620010,SOUTH,TAMIL NADU,TIRUCHIRAPALLI,Active,4.1,4
STH-TN-5275,SRM TRP ENGINEERING COLLEGE,"TRICHY-CHENNAI NH 45, MANNACHANALLUR (TK), IRUNGALUR,TIRUCHIRAPPALLI DISTRICT,TAMIL NADU 621105.",621105,SOUTH,TAMIL NADU,TIRUCHIRAPALLI,Inactive,4.4,4
STH-TN-5276,UNIVERSITY COLLEGE OF ENGINEERING-BIT CAMPUS,"BHARATHIDASAN INSTITUTE OF TECHNOLOGY CAMPUS ANNA UNIVERSITY,TIRUCHIRAPPALLI - 620 024.",620024,SOUTH,TAMIL NADU,TIRUCHIRAPALLI,Inactive,4.2,1609
STH-TN-5615,"GOVERNMENT INDUSTRIAL TRAINING INSTITUTE, CENTRAL PRISON","PUDUKKOTTAI ROAD, SUBRAMANIYAPURAM, 627758",627758,SOUTH,TAMIL NADU,TIRUCHIRAPALLI,Inactive,Govt. Venues/IITs/IIMs,Govt. Venues/IITs/IIMs
STH-TN-6071,JAYARAM COLLEGE OF ENGINEERING AND TECHNOLOGY,"KARATTAMPATTI, SH 62, PAGALAVADI, TIRUCHIRAPPALLI, TAMIL NADU-621014",606201,SOUTH,TAMIL NADU,TIRUCHIRAPALLI,Active,3.6,140
STH-TN-1710,NEHRU MEMORIAL COLLEGE-TRICHY,"PUTHANAMPATTI, TIRUCHIRAPALLI, TAMIL NADU - 621007",621007,SOUTH,TAMIL NADU,TIRUCHIRAPPALLI,Active,4,396
STH-TN-5613,"GOVERNMENT INDUSTRIAL TRAINING INSTITUTE FOR WOMEN, PULLAMBADI","THAPPAIROAD, PULLAMBADI, LALGUDI (TK), TRICHY (DT) - 621 711.",621711,SOUTH,TAMIL NADU,TIRUCHIRAPPALLI,Inactive,Govt. Venues/IITs/IIMs,Govt. Venues/IITs/IIMs
STH-TN-5614,"GOVERNMENT INDUSTRIAL TRAINING INSTITUTE, TRICHY","THANJAVUR ROAD, TRIRUVERUMBUR, TRICHY - 620 014",620014,SOUTH,TAMIL NADU,TIRUCHIRAPPALLI,Inactive,Govt. Venues/IITs/IIMs,Govt. Venues/IITs/IIMs
STH-TN-5744,MIET ENGINEERING COLLEGE,"DHAKSHINAPURAM, VALLATHIRAKOTTAI (PO), ALANGUDI(TK), PUDUKKOTTAI - 622305",622305,SOUTH,TAMIL NADU,TIRUCHIRAPPALLI,Inactive,3.9,400
STH-TN-5809,J J COLLEGE OF ENGINEERING AND TECHNOLOGY,"TRICHY DINDUGAL HIGHWAYS ROAD AMMAPETTAI, POOLANGULATHUPATTI POST, TRICHY, TAMIL NADU., 620009",620009,SOUTH,TAMIL NADU,TIRUCHIRAPPALLI,Inactive,-,-
STH-TN-5811,GOVERNMENT COLLEGE OF ENGINEERING-SRIRANGAM,"TRICHY-MADURAI HIGHWAY SETHURAPPATTI ROAD, TRICHY-620012",620012,SOUTH,TAMIL NADU,TIRUCHIRAPPALLI,Inactive,Govt. Venues/IITs/IIMs,Govt. Venues/IITs/IIMs
STH-TN-5829,DON BOSCO PRIVATE INDUSTRIAL TRAINING INSTITUTE-LALGUDI,"DON BOSCO ITI,NO-25,MANAKKALMAIN ROAD,LALGUDI,TRICHY-621601",621601,SOUTH,TAMIL NADU,TIRUCHIRAPPALLI,Inactive,Govt. Venues/IITs/IIMs,Govt. Venues/IITs/IIMs
STH-TN-5830,SHRI RAMAKRISHNA DALMIA PRIVATE INDUSTRIAL TRAINING INSTITUTE-TRICHY,"VADUGARPET DALMIAPURAM,TRICHY-621651",621651,SOUTH,TAMIL NADU,TIRUCHIRAPPALLI,Inactive,Govt. Venues/IITs/IIMs,Govt. Venues/IITs/IIMs
STH-TN-5878,AGN INFOSYSTEM,"SHED NO:3, SIDCO INDUSTRIAL ESTATE,THUVAKUDI, TRICHY TAMIL NADU - 620015",620015,SOUTH,TAMIL NADU,TIRUCHIRAPPALLI,Active,3.4,3
STH-TN-5885,SUDHARSAN ENGINEERING COLLEGE,"TRICHY-PUDUKKOTTAI MAIN ROAD,SATHIYAMANGALAM,PUDUKKOTTAI - 622501.",622501,SOUTH,TAMIL NADU,TIRUCHIRAPPALLI,Inactive,3.8,500
STH-TN-5956,GOVT ITI MANIKANDAM,"ALUNDUR,SRIRANGAM(TALUK),TRICHY-620012.",620012,SOUTH,TAMIL NADU,TIRUCHIRAPPALLI,Inactive,Govt. Venues/IITs/IIMs,Govt. Venues/IITs/IIMs
STH-TN-5984,IMAYAM COLLEGE OF ENGINEERING-TRICHY,"KANNANUR, THURAIYUR - TIRUCHIRAPPALLI MAIN RD, TIRUCHIRAPPALLI - 621206",621206,SOUTH,TAMIL NADU,TIRUCHIRAPPALLI,Active,3.6,3
STH-TN-6070,ANBU EXAM CENTER,"ANBU COLLEGE BLOCK, BEHIND CHRISTURAJ COLLEGE, NH45 TRICHY MADURAI HIGHWAY,
PANJAPPUR,TRICHY - 620012",620012,SOUTH,TAMIL NADU,TIRUCHIRAPPALLI,Active,3.9,12
STH-TN-1711,NELLAI COLLEGE OF ENGINEERING,"MARUTHAKULAM P.O., TIRUNELVELI, TAMIL NADU - 627151",627151,SOUTH,TAMIL NADU,TIRUNELVELI,Active,4.4,263
STH-TN-1712,SADAKATHULLAH APPA COLLEGE,"RAHMATH NAGAR, KAMARAJ NAGAR, TIRUNELVELI, TAMIL NADU - 627011",627011,SOUTH,TAMIL NADU,TIRUNELVELI,Inactive,4.2,517
STH-TN-5277,SCAD COLLEGE OF ENGINEERING AND TECHNOLOGY,"SCAD NAGAR, CHERANMAHADEVI, TIRUNELVELI-627414",627414,SOUTH,TAMIL NADU,TIRUNELVELI,Inactive,3.9,600
STH-TN-5278,CAPE INSTITUTE OF TECHNOLOGY,"RAJAKRISHNAPURAM (PO), LEVENGIPURAM, TIRUNELVELI-627114",627114,SOUTH,TAMIL NADU,TIRUNELVELI,Inactive,3.6,50
STH-TN-5279,PSN ENGINEERING COLLEGE,"MELATHEDIYOOR (PO), PIRANCHERI (VIA), PAPANASAM ROAD, TIRUNELVELI 627152",627152,SOUTH,TAMIL NADU,TIRUNELVELI,Inactive,3.7,3
STH-TN-5280,PSN INSTITUTE OF TECHNOLOGY & SCIENCE,"MELATHEDIYOOR (PO), PIRANCHERI (VIA), PAPANASAM ROAD, TIRUNELVELI 627152",627152,SOUTH,TAMIL NADU,TIRUNELVELI,Active,4.3,4
STH-TN-5281,ANNA UNIVERSITY REGIONAL CAMPUS-TIRUNELVELI,"TRIVANDRUM ROAD, PALAYAMKOTTAI, TIRUNELVELI DISTRICT 627007",627007,SOUTH,TAMIL NADU,TIRUNELVELI,Inactive,4,4
STH-TN-5616,"GOVERNMENT INDUSTRIAL TRAINING INSTITUTE, RADHAPURAM","VADAKKANKULAM ROAD,RADHAPURAM,TIRUNELVELI 627111",627111,SOUTH,TAMIL NADU,TIRUNELVELI,Inactive,Govt. Venues/IITs/IIMs,Govt. Venues/IITs/IIMs
STH-TN-5617,"GOVERNMENT INDUSTRIAL TRAINING INSTITUTE, TIRUNELVELI","PETTAI, TAMIL NADU 627004",627004,SOUTH,TAMIL NADU,TIRUNELVELI,Inactive,Govt. Venues/IITs/IIMs,Govt. Venues/IITs/IIMs
STH-TN-5753,PET ENGINEERING COLLEGE,"6, THIRUCHENDUR ROAD, TIRUNELVELI DISTRICT, VALLIYUR, TAMIL NADU 627117",627117,SOUTH,TAMIL NADU,TIRUNELVELI,Inactive,3.9,500
STH-TN-5777,SRI P M SANKARA SUBBIAH MEMORIAL PRIVATE INDUSTRIAL TRAINING INSTITUTE,"260/3/142, THIRUCHENDUR ROAD, V.M.CHATHRAM,TIRUNELVELI, 627011",627011,SOUTH,TAMIL NADU,TIRUNELVELI,Inactive,Govt. Venues/IITs/IIMs,Govt. Venues/IITs/IIMs
STH-TN-5778,GOVT ITI-AMBASAMUTHIRAM,",AMBASAMUTHIRAM,TIRUNELVELI-627401",627401,SOUTH,TAMIL NADU,TIRUNELVELI,Inactive,Govt. Venues/IITs/IIMs,Govt. Venues/IITs/IIMs
STH-TN-5799,EINSTEIN COLLEGE OF ENGINEERING,"SEETHAPARPANALLU , TIRUNELVELI DISTRICT 627012",627012,SOUTH,TAMIL NADU,TIRUNELVELI,Active,4.5,4
STH-TN-5854,EP INFOTECH,"THAMIRABHARANI ENGINEERING COLLEGE, CHATHIRAMPUDUKULAM VILLAGE, CHIDAMBRANAGAR – VEPAKULLAMROAD, THATCHANALLUR, TIRUNELVELI – 627358.",627358,SOUTH,TAMIL NADU,TIRUNELVELI,Active,3.6,3
STH-TN-1732,GOVERNMENT INDUSTRIAL TRAINING INSTITUTE-VANIYAMBADI,"VEPAMARATHUSALAI, VALAYAMBATTU, VANIYAMBADI, TAMIL NADU, 635752",635752,SOUTH,TAMIL NADU,TIRUPATHUR,Active,-,-
STH-TN-5251,PODHIGAI COLLEGE OF ENGINEERING & TECHNOLOGY,"SALEM ROAD, ADIYUR, TIRUPATTUR, VELLORE, 635601",635601,SOUTH,TAMIL NADU,TIRUPATHUR,Active,3.8,3
STH-TN-5282,MARUDHAR KESARI JAIN COLLEGE FOR WOMEN,"MARUDHACHALAM NAGAR, CHINNAKALLUPALLI, VANIYAMBADI, VELLORE, 635751",635751,SOUTH,TAMIL NADU,TIRUPATHUR,Active,4,4
STH-TN-5618,ISLAMIAH PRIVATE INDUSTRIAL TRAINING INSTITUTE,"ALANGAYAM ROAD, NEW TOWN, VANIYAMBADI, TIRUPATHUR DIST, 635701",635701,SOUTH,TAMIL NADU,TIRUPATHUR,Active,Govt. Venues/IITs/IIMs,Govt. Venues/IITs/IIMs
STH-TN-5705,ISLAMIAH COLLEGE( AUTONOMOUS),"ISLAMIAH COLLEGE( AUTONOMOUS) FOR MEN , NEW TOWN, VANIYAMBADI- TIRUPATTUR, 635752",635752,SOUTH,TAMIL NADU,TIRUPATHUR,Active,4.4,694
STH-TN-5821,BHARATHIDASAN ENGINEERING COLLEGE,"CHENNAI-BANGALORE HIGHWAY, M.G.R NAGAR, NATTRAMPALLI, 635852",635852,SOUTH,TAMIL NADU,TIRUPATHUR,Active,4.5,5
STH-TN-5894,TIRUPATTUR PRIVATE INDUSTRIAL TRAINING INSTITUTE,"VANIYAMPADI ROAD , SALAI NAGAR, TIRUPATTUR TAMIL NADU, 635601",635601,SOUTH,TAMIL NADU,TIRUPATHUR,Active,Govt. Venues/IITs/IIMs,Govt. Venues/IITs/IIMs
STH-TN-5283,JAY SHRI RAM ENGINEERING COLLEGE,"DHARAPURAM ROAD, AVINASHIPALAYAM, TIRUPPUR 638 660, 638660",638660,SOUTH,TAMIL NADU,TIRUPPUR,Active,4.3,4
STH-TN-5284,BUILDERS ENGINEERING COLLEGE,"MULLIPURAM POST, NATHAKADAIYUR, KANGEYAM,, 638108",638108,SOUTH,TAMIL NADU,TIRUPPUR,Active,3.6,11
STH-TN-5285,TIRUPPUR KUMARAN COLLEGE FOR WOMEN,"MANGALAM ROAD, S.R.NAGAR, TIRUPPUR, TAMIL NADU 641687",641687,SOUTH,TAMIL NADU,TIRUPPUR,Active,-,-
STH-TN-6089,MARUTHU PANDIYAR COLLEGE,"THANJAVUR TO TRICHY HIGHRWAY, NEAR COLLECTOR OFFICE, PILLAYARPATTI, TAMIL NADU 613403",613403,SOUTH,TAMIL NADU,TIRUPPUR,Active,3.9,112
STH-TN-6090,JANSONS INSTITUTE OF TECHNOLOGY,"JANSONS INSTITUTE OF TECHNOLOGYKARUMATHAMPATTI,TIRUPPUR – 641-659 , TAMIL NADU",641659,SOUTH,TAMIL NADU,TIRUPPUR,Active,4.5,291
STH-TN-5787,GOVT ITI-TIRUPUR,"OPP. TO GOVERNMENT HOSPITAL, GKMR NAGAR, TIRUPPUR, TAMIL NADU 641605",641605,SOUTH,TAMIL NADU,TIRUPUR,Active,Govt. Venues/IITs/IIMs,Govt. Venues/IITs/IIMs
STH-TN-5788,GOVT ITI-DHARMAPURAM,"NANJAIYAMPALAYAM, DAHARAPURAM,TIRUPUR-638656",638656,SOUTH,TAMIL NADU,TIRUPUR,Active,Govt. Venues/IITs/IIMs,Govt. Venues/IITs/IIMs
STH-TN-5808,AMBAL PROFESSIONAL GROUP OF INSTITUTIONS,"K.N. PURAM, TRICHY RD, PALLADAM, TIRUPUR,TAMIL NADU 641662",641662,SOUTH,TAMIL NADU,TIRUPUR,Active,Govt. Venues/IITs/IIMs,Govt. Venues/IITs/IIMs
STH-TN-5877,GOVERNMENT INDUSTRIAL TRAINING INSTITUTE-UDUMALPET,"KANNAMANAICKENUR,UDUMALPET,TAMILNADU642128",642128,SOUTH,TAMIL NADU,TIRUPUR,Active,Govt. Venues/IITs/IIMs,Govt. Venues/IITs/IIMs
STH-TN-5761,VEL TECH HIGH TECH DR RANGARAJAN DR SAKUNTHALA ENGINEERING COLLEGE (AUTONOMOUS),"NO.60, AVADI-VEL TECH ROAD, VEL NAGAR, AVADI - CHENNAI, TAMILNADU-600062",600062,SOUTH,TAMIL NADU,TIRUVALLUR,Active,4,1200
STH-TN-5762,VEL TECH MULTI TECH DR RANGARAJAN DR SAKUNTHALA ENGINEERING COLLEGE(AUTONOMOUS),"NO.42, AVADI-VEL TECH ROAD, VEL NAGAR, AVADI,THIRUVALLUR,CHENNAI, TAMILNADU - 600062",600062,SOUTH,TAMIL NADU,TIRUVALLUR,Active,4,1000
STH-TN-5257,ARUNAI ENGINEERING COLLEGE,"VELU NAGAR, MATHUR, THIRUVANNAMALAI, 606603",606603,SOUTH,TAMIL NADU,TIRUVANNAMALAI,Active,3.8,3
STH-TN-5258,SKP ENGINEERING COLLEGE,"NH-66, SOMASIPADI (PO), CHINNAKANGIYANUR, THIRUVANNAMALAI, 606611",606611,SOUTH,TAMIL NADU,TIRUVANNAMALAI,Active,4.6,4
STH-TN-5379,ANNAMALAIYAR COLLEGE OF ENGINEERING,"CHETPET - POLUR ROAD,MUDAIYUR,THIRUVANNAMALAI, 606902",606902,SOUTH,TAMIL NADU,TIRUVANNAMALAI,Active,3.5,3
STH-TN-5380,THIRUVALLUVAR COLLEGE OF ENGINEERING AND TECHNOLOGY,"PONNUR HILLS, VANDAVASI, TIRUVANNAMALAI DISTRICT, TAMILNADU, 604505",604505,SOUTH,TAMIL NADU,TIRUVANNAMALAI,Active,3.7,400
STH-TN-5402,UNIVERSITY COLLEGE OF ENGINEERING-ARNI,"ARNI DEVIKAPURAM ROAD,THATCHUR, ARNI,ARNI TALUK,THIRUVANNAMALAI (DIST),TAMIL NADU, 632326",632326,SOUTH,TAMIL NADU,TIRUVANNAMALAI,Active,4.2,1609
STH-TN-5619,CHEYYAR PRIVATE INDUSTRIAL TRAINING INSTITUTE,"ARNI ROAD, CHEYYAR - THIRUVANNAMALAI DIST, 604407",604407,SOUTH,TAMIL NADU,TIRUVANNAMALAI,Active,Govt. Venues/IITs/IIMs,Govt. Venues/IITs/IIMs
